portfolio,website,year,summaryCreditKarma,http://creditkarma.com/,,"Credit Karma offers truly free access to credit reports and scores, personalized financial recommendations and educational resources."Remind,https://www.remind.com/,,Remind is a web and mobile application that enables teachers to text message students and stay in touch with parents.Talkdesk,http://talkdesk.com/,,"Talkdesk is an easy-to-use, cloud-based call center software solution that helps improve customer interactions while reducing costs."Udemy,http://udemy.com/,,"Udemy provides a marketplace for online learning that makes content from experts available to anyone, anywhere. It currently offers more than 16,000 courses on a wide range of topi"Smule,http://khu.sh/,,"Khush develops music applications such as LaDiDa, a reverse karaoke iPhone app that analyzes the user's voice and composes music to match."Intercom,http://intercom.io/,,"Intercom provides a personal messaging service for Internet businesses and their customers. It provides a single, integrated platform for the whole company to use for support, mar"Realty Shares,http://realtyshares.com/,,RealtyShares is an online marketplace for real estate investingVivaReal,http://vivareal.com.br/,,"VivaReal is an online real estate marketplace connecting buyers, sellers and renters with properties in Latin America."Ohmconnect,http://ohmconnect.com/,,"OhmConnect monitors real-time conditions on the electricity grid. When dirty and unsustainable power plants turn on, our users receive a notification to save energy."Kinnek,http://kinnek.com/,,Kinnek is a B2B platform that allows small businesses to request and receive customized quotes from suppliers for their purchases.Tokyo Otaku Mode,http://otakumode.com/,,"Tokyo Otaku Mode delivers the latest news on Japanese anime, manga, games, and more through its Facebook page."WePay,http://wepay.com/,,"WePay is an online payment service provider in the United States. WePay's payment API focuses exclusively on platform businesses such as crowdfunding sites, marketplaces and small "Konfio,http://konfio.mx/,,The instant online lending platform for latam.BarkBox,http://barkbox.com/,,Barkbox is a subscription-based e-commerce and content company for dog lovers.Canva,http://canva.com/,,Canva is an online design platform that allows users to create professional quality graphics with ready-made templates.LE TOTE,http://letote.com/,,LE TOTE is a fashion discovery platform that connects brands with consumers through a rental model.Algolia,http://algolia.com/,,Algolia provides a hosted search API that allows websites and mobile applications to increase user engagement and conversions.99 minutos,http://99minutos.com/,,Ship anywhere within Mexico City in under 99 minutes. Lucid Chart,http://golucid.co/,,"Lucidchart is your solution for visual communication. Online flowcharts, diagrams, UML sketches, and ER models have never been easier. Start a free trial today!"Avanoo,http://avanoo.com/,,Renowned Experts Improving Your TeamStyleseat,http://styleseat.com/,,"StyleSeat is the leading destination for booking beauty and wellness appointments. With StyleSeat, industry experts gain a place to showcase their work, connect with clients, and b"CreditKarma,http://creditkarma.com/,,"Credit Karma offers truly free access to credit reports and scores, personalized financial recommendations and educational resources."Remind,https://www.remind.com/,,Remind is a web and mobile application that enables teachers to text message students and stay in touch with parents.Talkdesk,http://talkdesk.com/,,"Talkdesk is an easy-to-use, cloud-based call center software solution that helps improve customer interactions while reducing costs."Udemy,http://udemy.com/,,"Udemy provides a marketplace for online learning that makes content from experts available to anyone, anywhere. It currently offers more than 16,000 courses on a wide range of topi"Smule,http://khu.sh/,,"Khush develops music applications such as LaDiDa, a reverse karaoke iPhone app that analyzes the user's voice and composes music to match."Intercom,http://intercom.io/,,"Intercom provides a personal messaging service for Internet businesses and their customers. It provides a single, integrated platform for the whole company to use for support, mar"Realty Shares,http://realtyshares.com/,,RealtyShares is an online marketplace for real estate investingVivaReal,http://vivareal.com.br/,,"ivaReal is an online real estate marketplace connecting buyers, sellers and renters with properties in Latin America."Ohmconnect,http://ohmconnect.com/,,"OhmConnect monitors real-time conditions on the electricity grid. When dirty and unsustainable power plants turn on, our users receive a notification to save energy."Kinnek,http://kinnek.com/,,Kinnek is a B2B platform that allows small businesses to request and receive customized quotes from suppliers for their purchases.Tokyo Otaku Mode,http://otakumode.com/,,"Tokyo Otaku Mode delivers the latest news on Japanese anime, manga, games, and more through its Facebook page."WePay,http://wepay.com/,,"WePay is an online payment service provider in the United States. WePay's payment API focuses exclusively on platform businesses such as crowdfunding sites, marketplaces and small "Konfio,http://konfio.mx/,,The instant online lending platform for latam.BarkBox,http://barkbox.com/,,Barkbox is a subscription-based e-commerce and content company for dog lovers.Canva,http://canva.com/,,Canva is an online design platform that allows users to create professional quality graphics with ready-made templates.LE TOTE,http://letote.com/,,LE TOTE is a fashion discovery platform that connects brands with consumers through a rental model.Algolia,http://algolia.com/,,Algolia provides a hosted search API that allows websites and mobile applications to increase user engagement and conversions.99 minutos,http://99minutos.com/,,Ship anywhere within Mexico City in under 99 minutes.Lucid Chart,http://golucid.co/,,"Lucidchart is your solution for visual communication. Online flowcharts, diagrams, UML sketches, and ER models have never been easier. Start a free trial today!"Avanoo,http://avanoo.com/,,Renowned Experts Improving Your TeamStyleseat,http://styleseat.com/,,"StyleSeat is the leading destination for booking beauty and wellness appointments. With StyleSeat, industry experts gain a place to showcase their work, connect with clients, and b"Shippo,http://goshippo.com/,,"Shippo makes shipping easy & cheap for ecommerce stores, with a developer-friendly API & seamless web interface."Enchanted Diamonds,http://enchanteddiamonds.com/,,Enchanted Diamonds is an e-commerce platform that offers personalized engagement rings for customers.Life360,http://life360.com/,,Life360 is the leading Family Network with 43M families using proprietary location-based technology. The company processes over 1 billion location requests per day and enables famiVungle,http://vungle.com/,,Vungle is the way developers put video ads in their apps.Lottery.com,http://autolotto.com/,,"AutoLotto is the best way to play the lottery. You never need to wait in line, deal with lost tickets, or check numbers again. "Sentisis Analytics,http://sentisis.com/,,"Sentisis, based in Madrid, Spain, develops tools to process and analyze key information from social networks. "PlanGrid,http://plangrid.com/,,"PlanGrid is a cross-platform, construction field-enablement platform providing real-time updates and seamless file synching over Wi-Fi and cellular radio. "Conta Azul,http://contaazul.com/,,"ContaAzul, a management system, allows micro and small businesses to control their finances, sales, and stock; and send electronic invoices. "HeadOut,http://headout.com/,,Headout is an on-demand mobile concierge helping travelers book the best local experiences for the next 24 hours at discounted prices. Recurly,http://recurly.com/,,Recurly is a SaaS-based company providing recurring billing management as an outsourced service. Unbounce,http://unbounce.com/,,"Unbounce Marketing Solutions provides self-serve hosted services that enable marketers to create, publish, and test landing pages. "Breather,http://breather.com/,,Breather is a network of beautiful city spaces that you can unlock at any time. Zolvers,http://zolvers.com/,,Zolvers is a marketplace for securely hiring home cleaning and home repair tasks Zolvers allows people to find qualify and confidence persons to help them on home tasks. Zolvers al PredictionIO,http://prediction.io/,,"PredictionIO is an open source machine learning server for software developers to create predictive features, such as personalization, recommendation and content discovery. "Womply,http://womply.com/,,"Womply uses technology and data to grow, protect, and simplify small business "Siftery,http://credii.com/,,Siftery allows you to share products you use at work and explore what others are using. Bustle,http://bustle.com/,,"Bustle is a news, entertainment, lifestyle and fashion website that caters to women. "Neighbor.ly,https://neighborly.com/,,Community Investment Marketplace Boost Media,http://boostmedia.com/,,Boost Media is a startup that uses crowdsourcing and split testing to help businesses find effective words and images for their online ads. CultureAlley,http://culturealley.com/,,CultureAlley is an online language education platform. Vulcun,http://higear.com/,,"Vulcun offers the largest prize pools in Fantasy eSports today, allowing gamers to support their favorite pro players and win hundreds of thousands in real money each season. "YogoMe,http://yogome.com/,,Educational Mobile Games for Kids TuckerNuck,http://tnuck.com/,,Tuckernuck is an online boutique that puts a fresh spin on classic American style. DailyMuse,http://themuse.com/,,"The Muse is the most trusted career brand for Millennials, helping 4+ million people/month find jobs & succeed in their careers. "uBiome,http://ubiome.com/,,"uBiome, Inc. provides a microbiome sequencing service that provides information and tools for users to explore their microbiome. "FirstOpinion,http://firstopinion.co/,,First Opinion - Text a Doctor Tradesy,http://tradesy.com/,,"Tradesy is an e-commerce platform that trades used clothing, shoes, bags, and accessories. "Chewse,http://chewse.com/,,"Chewse, an online platform, allows office workers to browse through catering menus from local restaurants to create personalized menus. "TotSpot,http://totspot.me/,,Totspot is a mobile marketplace for moms to shop and sell kids fashion. Funnely,http://funne.ly/,,Funnely optimices Facebook ads conversion funnel for E-commerce companies. It is a SaaS that uses the power of behavioral data to optimize social ads campaigns through Facebook. Bukalapak,http://bukalapak.com/,,Bukalapak connects individual-small medium company to Indonesian consumers in just few minutes. Bukalapak help them prosper and success with the platform. Mayvenn,http://mayvenn.com/,,"Mayvenn is a service for African American hairstylists to add a retail component to their business. Using Mayvenn, hair stylists can create personalized e-commerce websites and mob "Stupeflix,http://stupeflix.com/,,Replay is an iPhone application dedicated to providing an easy and fast tool to create videos. ViralGains,http://viralgains.com/,,The Global Platform for Viral Video Zesty,http://zesty.com/,,"Zesty delivers fresh meals from local restaurants. For every dish, often cooked in a healthier way or created off-menu, exclusively for Zesty, nutrition facts are provided. "Venzee,http://venzee.com/,,"With Venzee, vendors and retailers have a central hub to share and receive product information adapted to any sales channel or platform. Our tool allows anyone to automate the proc "Wildfire,http://wildfireapp.com/,,"Wildfire, a division of Google, is a provider of enterprise social media marketing software. "Contactually,http://contactually.com/,,Contactually is a relationship marketing platform that helps companies and individuals keep and generate business from their network. Bombfell,http://bombfell.com/,,Bombfell is an online clothing retail store providing personalized clothes for men. Rover,http://roverlabs.co/,,iBeacon platform that enables retailers to deliver content based on a customer's location within a store. SendGrid,http://sendgrid.com/,,"SendGrid is a proven, cloud-based customer communication platform that drives engagement and business growth. "InstaGIS,http://instagis.com/,,Global realtime platform of decision-making data for marketers. Givesurance,http://givesurance.org/,,Funding platform for charities that enables supporters to make annual donations through their existing insurance payment. EquityZen,http://equityzen.com/,,Marketplace for pre-IPO investments Instamojo,http://instamojo.com/,,Democratizing payments for everyone. eSpark,http://esparklearning.com/,,eSpark's solution has been proven to help districts leverage iPads and the ecosystem of educational apps to improve student achievement. KiteReaders,http://kitereaders.com/,,"KiteReaders is the platform for publishers & authors to create, distribute & market their children's picture books for iBooks, Kindle and Nook stores "Cuponomia,http://cuponomia.com.br/,,online Coupon codes for major retailers WalkerCo,http://walkerandcompany.com/,,We make health and beauty simple for people of color. Sunrise,http://sunrise.am/,,"Sunrise is a free calendar app specifically designed to make your life easier. Available on Android, iPhone, iPad, Mac & Web. "Trusted Insight,http://thetrustedinsight.com/,,Trusted Insight is the leading Institutional Syndication Platform for Alternative Assets. Its members manage over $18 Trillion in AUM. GoSpotCheck,http://gospotcheck.com/,,GoSpotCheck develops web and mobile apps that help employees gather real-time retail intelligence information from the field. Viki,http://viki.com/,,"Viki is a global TV site that streams TV shows, movies and other premium content, translated into more than 200 languages by a community of avid fans. With nearly 1 billion words t "AdEspresso,http://adespresso.com/,,"AdEspresso offers services for advertisers and media agencies to create, analyze, and optimize their Facebook advertisements. "Estately,http://estately.com/,,Estately is a real estate search site where users can search for information on houses for sale on a map and view detailed descriptions. Blueboard,http://blueboard.com/,,The best employee rewards. Fave,http://kfit.com/,,"KFit seamlessly connects consumers and fitness businesses in key cities across Asia Pacific. It gives people more ways to stay healthy and keep fit, creating new business opportuni "Iterable,http://iterable.com/,,"Iterable makes consumer growth marketing simple. Using Iterable, marketers send the right message, to the right device, at the right time. "ToutApp,http://toutapp.com/,,Toutapp is a communication platform enabling sales individuals track emails and maintain a healthy CRM. Papaya,http://www.cinepapaya.com/,,"Cinepapaya.com is a platform for the online and mobile sales of movie tickets for emerging markets, offering a B2B E-commerce turn-key solution for partner movie theatres including "Hinge,http://hinge.co/,,Hinge is a social discovery network helping users meet new people through friends. AuditFile,http://auditfile.com/,,AuditFile.com offers cloud-based auditing solutions for CPA firms. Flywire,http://peertransfer.com/,,"Flywire, formerly PeerTransfer, helps users save money and time to educational institutions and their international students when paying and processing tuition and fees. "Contently,https://contently.com/,,Empowering brands and journalists to connect and tell stories MyTime,http://mytime.com/,,"MyTime provides an iPhone or Android app to book appointments online with over two million businesses nationwide for haircuts, massages, dog grooming and more. The new MyTime Sched "Eko,http://ekoapp.com/,,Enterprise mobile messaging with integrated task and project management Brainient,http://brainient.com/,,"Brainient give clients the tools to create rich, engaging and interactive video formats which can be delivered across a range of devices. "Conekta,http://conekta.io/,,Conekta is a platform that allows businesses in Latin America to process online payments using both online and offline methods. OwnLocal,http://ownlocal.com/,,OwnLocal is the automated digital ad agency for local media. Compstak,http://compstak.com/,,"CompStak employs a crowdsourced model to gather commercial real estate information for investors, brokers, asset managers and appraisers. "Giftcard Zen,http://giftcardzen.com/,,GiftcardZen is a giftcard marketplace wherein particpants buy and sell discards from numerous merchants. Silverpush,http://silverpush.co/,,Creating a single digital identity across devices Storytree,http://storytree.me/,,"Use the photos from your mobile phone, Facebook, Instagram and Dropbox to create the perfect album. All of our books are handmade in California and exclusively printed on high-qual "Senzari,http://senzari.com/,,Senzari develops data and intelligence solutions for the media and entertainment industry. Epic!,https://www.getepic.com/,,"Epic! opens the doors to a new world of reading for kids 12 and under by providing an unlimited selection of eBooks that can be instantly discovered, read and shared with friends. "CoContest,http://cocontest.com/,,CoContest offers an online crowdsourcing platform for interior design. CoContest allows customers wanting to refurbish an existing space to put their project out to architects and HappyCo,http://happyco.com/,,HappyCo is taking traditional paper based processes out of the dark ages. Boatbound,http://boatbound.co/,,Boatbound is a fully insured pier-to-pier marketplace for boat rentals in the U.S. StudySoup,http://studysoup.com/,,StudySoup is a peer-to-peer marketplace through which college students can buy and sell high quality study materials. Gyft,http://gyft.com/,,"Gyft is a mobile gift card app that allows customers to buy, store, send and redeem gift cards conveniently from their mobile device. Gyft is seamlessly integrated with Facebook so "Virool,http://virool.com/,,"Virool is a programmatic video marketing platform for individuals, small businesses and global brands and their agencies. "BTCJam,http://btcjam.com/,,"BTCJam is the first and leading GLOBAL peer to peer lending platform, and the first to offer a global credit score to its users. "Italist,http://italist.com/,,"Italist is revolutionizing the online distribution of Italian luxury clothes, shoes and accessories. Italist, based in Beverly Hills, CA, is the first online marketplace fully dedi "AdStage.io,http://adstage.io/,,"AdStage Inc. is an advertising technology startup building advanced tools to help businesses build, manage and optimize online ad campaigns. "AutoChilango,http://autochilango.com/,,Legal and bureaucracy assistance for your car. Cotiza y Contrata,http://cotizaycontrata.com/,,Connecting people who need a service with professionals. Facturama,http://facturama.mx/,,Simplifies a company?s billing proces in Mexico. GazeMetrix,http://gazemetrix.com/,,Gazemetrix offers brands insight into when and where their brand was photographed across social media in real time. Winc,http://clubw.com/,,"Club W is a California based direct-to-consumer winery that is revolutionizing the way people discover, buy and share wine. "RolePoint,http://rolepoint.com/,,Re-imagining talent acquisition for the enterprise. RolePoint are building software that is changing the way talent is sourced. Thinknum,http://thinknum.com/,,Thinknum is a powerful web platform to value companies. We?re utilizing the web?s resources in data and technology to provide superior tools for financial analysts ? they include p Monkimun,http://monkimun.com/,,Monkimun is a new game studio dedicated to designing fun language educational apps for children. KartRocket,http://kartrocket.com/,,"KartRocket help SMEs, manufacturers, creative people and service providers set up their brands online. "Dealflicks,http://dealflicks.com/,,"Dealflicks provides movie tickets and concessions for discounted prices, helping theaters fill their empty seats. "Keen.io,http://keen.io/,,Keen IO is a custom analytics back-end for developers. Build and embed analytics for your teams and your customers. Mocavo,http://mocavo.com/,,Mocavo is a genealogy and ancestry search engine enabling users to discover their family history. Ingresse,http://ingresse.com/,,"Ingresse, a Brazilian social ticketing company that enables people to discover the latest concerts, nightclubs, parties, and theater plays. "Internmatch,http://internmatch.com/,,LookSharp helps every student launch their career Soldsie,http://soldsie.com/,,"Soldsie is a social commerce platform that allows customers to purchase products through comments on Facebook, Instagram, and Pinterest. "Geckoboard,http://geckoboard.com/,,Geckoboard is a real time data dashboard that helps you and your team stay focused on the metrics that matter. Ordoro,http://ordoro.com/,,Supply chain backbone for ecommerce Greentoe,http://greentoe.com/,,Greentoe is a name your price marketplace bringing market pricing to retail. Chain,http://chain.com/,,"Chain Inc. partners with leading financial institutions to build and deploy blockchain networks that enable seamless, programmatic and peer-to-peer transfer of digital assets. The "LocoMotive Labs,http://locomotivelabs.com/,,"LocoMotive Labs develops assistive and play-based apps for children with special needs, encouraging them to be independent learners. "Traity,http://traity.com/,,"Traity aims to create a world where we can trust one another, building a reputation standard. "Tynker,http://tynker.com/,,Tynker is a browser-based computational learning platform teaching programming skills for children. iDreamBooks,http://idreambooks.com/,,Book discovery tool with a rating and recommendation system Lish,http://lishfood.com/,,Handcrafted meals from award-winning local chefs. 9GAG,http://9gag.com/,,9GAG.TV is a website that features user-generated videos under various categories. Boletia,http://boletia.com/,,Boletia helps event organizers to unleash the potential of online sales without needing technical or online marketing expertise. It does this with an easy-to-use platform and a str Cloud Academy,http://cloudacademy.com/,,Cloud Academy is a platform to learn cloud computing and test your skills. Pic Collage,http://cardinalblue.com/,,"Cardinal Blue Software offers an app that allows users to create and share free-form collages made by images, text and stickers. "NoRedInk,http://noredink.com/,,NoRedInk is a web-based learning platform supporting students to improve their grammar and writing skills. Carousell,http://carousell.com/,,Carousell is a Singapore-based consumer-to-consumer marketplace application for iOS and Android. MisterBnB,http://misterbnb.com/,,Largest gay-friendly hotelier in the world Moj.io,http://moj.io/,,"Mojio is the worlds leading open platform for cars. Connect your car to your favorite people, places and things. Driving 2.0. "VTS,http://vts.com/,,"VTS gives asset managers & leasing teams a single platform to track deals, manage space & collaborate seamlessly. "CircleCI,http://circleci.com/,,CircleCI is an automated testing and continuous integration platform for web application developers. GymTrack,http://gymtrack.co/,,Gymtrack builds smart aftermarket equipment that allows gym members to automatically track their workouts and access virtual personal training. CinemaCraft,http://cinemacraft.tv/,,Cinemacraft is a leading interactive media monetization platform. MURAL,http://mural.co/,,Online tools focused on team collaboration around design thinking. NativeAd,http://native.ad/,,"Native advertising distribution platform, that integrates and adapts branded content campaigns to the user experience and to the editorial content of the premium publishers. "Partender,http://partender.com/,,Partender is a business tool that reduces the time it takes owners and managers to do bar inventory from a frustrating 6-24 hours to 15 minutes or less. Whill,http://whill.us/,,WHILL is a next-generation personal mobility device company. We focus on smart design and advanced technology to create personal mobility that fits your lifestyle. All Directional StackSocial,http://stacksocial.com/,,StackCommerce is an innovative revenue stream for content publishers. Makers of StackSocial. Upguard,http://upguard.com/,,"UpGuard (formerly ScriptRock) is a digital resilience company that evaluates ongoing configuration of every server, database and device in your company's infrastructure, to provide "Fabelio,http://fabelio.com/,,"Fabelio is a furniture e-commerce startup which offers affordable, design-centric items by leveraging unique partnerships with designers. "PixOwl,http://pixowl.com/,,"Pixowl is a social mobile gaming studio making games with famous family brands: Garfield, Peanuts, Alvin and The Sandbox! "Chaldal,http://chaldal.com/,,online grocery shopping & delivery MyHealthTeams,http://myhealthteams.com/,,MyHealthTeams creates social network for chronic condition communities. Brilliant,http://brilliant.org/,,Brilliant is a high-quality free online mathematics and science problem solving website for high aptitude students around the world. SkimLinks,http://skimlinks.com/,,SkimLinks is a simplified affiliate marketing tool for publishers to convert existing links into affiliate marketing links. Shopeando,http://shopeando.mx/,,Shopeando is an online retailer that offers a wide array of unbranded products. Pijon,http://pijonbox.com/,,Pijon is a NYC-based technology company that specializes in sending college students monthly care packages filled with awesome products 