portfolio,website,year,summaryLaunchRock,http://launchrock.com/,,LaunchRock is a startup helping firms setup a viral launching soon page and help get users. UmbaBox,http://umba.com/,,Umba (www.umba.com) is a social-selling platform that connects our entrepreneurial Umbassadors with artists around the world. Pay By Group,http://paybygroup.com/,,"PayByGroup is a group payment platform facilitating money collection from friends, family and others. "SiteJabber,http://sitejabber.com/,,SiteJabber helps consumers find trustworthy online businesses and avoid scams. WePow,http://wepow.com/,,"WePow is a global leader in recruitment communication, offering breadth, depth, and a personal touch to attracting talent. "Pal+,http://palplus.me/,,"Pal+ (formerly Cubie) is a free mobile messaging app that allows users to create and share images, videos and voice messages while chatting with others. "Amicus,http://amicushq.com/,,Amicus allows non-profit organizations to turn their supporters into advocates and fundraisers. Eversnap Photography,http://weddingsnap.com/,,"Eversnap App enables weddings, events, & groups to collect all their guests photos & videos in one online album via our iPhone, Android and Web Apps. "Partnered,http://partnered.com/,,The company-to-company business development network connecting startups and brands Dakwak,http://dakwak.com/,,Dakwak offers a website translation and localization platform for small and medium-sized businesses. HeartThis,http://heartthis.com/,,HeartThis is a free way to shop all your favorite stores in one place. Use HeartThis to conveniently browse products and sales from your favorite stores and discover new things you TradeBriefs,http://tradebriefs.com/,,Daily industry Knowledge PingPad,https://pingpad.net/,,Social Productivity Node.io,http://node.io/,,"Node has developed technology that is reorganizing the web to facilitate personalized discovery, where relevant information will be automatically recommended to the user, at the ri "Chouxbox,http://chouxbox.com/,,ChouxBox is an invoice transcription service for restaurants. Wiselike,http://wiselike.com/,,Wiselike is a knowledge-sharing platform that allows users to create professional Q&A pages where people can ask them questions. Whim App,http://whim.la/,,"Whim is a mobile app that curates and coordinates first dates, on demand. Their solution eliminates the extensive search, targeting, messaging, and planning required by existing da "Remoov,http://remoovit.com/,,"Decluttering service that helps customers sell, donate, or discard items. "UXCam,http://uxcam.com/,,"UXCam is a UX optimization tool for mobile apps, which offers a cost-effective way to capture data with real context and visualize it. "Astroprint,http://astroprint.com/,,Cloud OS and developer platform for 3D Printing (500 Startups B11) Hello Bit,http://hellobit.com/,,Send money globally and have it picked up or delivered by a human ATM HeTexted,http://hetexted.com/,,HeTexted is a vertical advising platform providing suggestions about dating and relationships. ZipZap,http://zipzap.me/,,ZipZap is a technology platform for moving money around the world. Thinglink,http://thinglink.com/,,Thinglink is an image engagement tool that lets users add clickable tags to web images and share the tagged images on social networks. Proleads,http://proleads.io/,,ProLeads is a big data platform for lead qualification in enterprise sales. The platform analyses people based on their email and qualifies them using machine learning algorithms a Raur,http://raur.co/,,"RAUR is a social publishing platform for podcasts built to simplify discovery, listening, and creation of content. "ArtCorgi,http://artcorgi.com/,,"A marketplace for personalized illustrations featuring you and your favorite pets, characters, and people. "Puzzlium,http://puzzlium.com/,,1st puzzle social network. Play. Create. Compete. Eponym,http://eponymous.co/,,Eponym is an online platform enabling brands to create and distribute prescription eyewear and sunglasses through their own stores. Neuroware.io,http://neuroware.io/,,"An open source wallet with themes and plugins that offers a simplified framework for blockchain based applications. APIs that offer full turn-key solutions for developers, capable "TrustCloud,http://trustcloud.com/,,TrustCloud has developed solutions to evaluate participants in the sharing economy. Anyadir Education,http://admissiontable.com/,,Anyadir Education empowers universities to recruit students socially. They have developed a mobile platform that enables universities to reach out to a large number of prospective Revivn,http://revivn.com/,,Revivn helps companies repurpose their unused hardware to underserved communities. Timbuktu,http://timbuktu.me/,,"Timbuktu Labs develops an educational application that enables children to play games, read news, and view beautiful pictures. "TeliportMe,http://teliportme.com/,,Teliportme is a panorama app that enables users to explore and share places through images. Babelverse,http://babelverse.com/,,People-Powered Universal Translator for Live Conversations. Enabling Global Communication. Femeninas,http://femeninas.com/,,femeninas.com is a fashion destination brand and social engagement platform where designers and brands can interact with the community. Floqq,http://floqq.com/,,Floqq is the biggest marketplace for online video courses in Latin America EverBill,http://everbill.com/,,"everbill enables startups and SMEs to create invoices and estimates, and share them with customers and suppliers via a SaaS-based app. "TrueLens,http://truelens.com/,,"TrueLens is a CRM platform providing Socialgraphic insights into customers, enabling brands to increase ROI and revenue. "Tealet,http://tealet.com/,,Online Farmer's Market for Tea on Bitcoin WhoAPI,http://whoapi.com/,,WhoAPI is an API service for mass requests of domain information like domain registration availability and structured whois data in JSON. FounderDating,http://founderdating.com/,,FounderDating is a network of entrepreneurs focusing on connecting with professionals and skilled individuals. PayDragon,http://paydragon.com/,,PayDragon is a mobile commerce app that allows users to order and pay for groceries from local stores. Welcu,http://welcu.com/,,Welcu develops tools to allow customers to organize events such as selling tickets and sending invitations. Tie Society,http://tiesociety.com/,,Netflix for menswear. Members rent from our online closet of high-end accessories. Bizeebee,http://bizeebee.com/,,"BizeeBee is a membership management platform enabling entrepreneurs to track revenue and attendance, manage member relationships, and more. "Vayable,http://vayable.com/,,"Vayable is an online marketplace enabling people to discover, buy and sell unique travel experiences, activities and extended trips. "ManPacks,http://manpacks.com/,,"Manpacks is a web-based service delivering men's essentials such as underwear, razors, condoms, grooming and other products "FileBoard,http://fileboard.com/,,Sales Engagement Platform RentLord,http://rentlord.com/,,Rentlord is an online social platform enabling landlords and tenants to rent homes. WholeShare,http://wholeshare.com/,,Wholeshare saves people up to 20% on their groceries through collective purchasing. Wholeshare helps consumers bypass retail stores and get wholesale prices by organizing group pur Toshl,http://toshl.com/,,Toshl helps you keep your finances in shape. Experiment,http://experiment.com/,,Experiment is an online community and a crowdfunding platform for scientific research. Dropifi,http://dropifi.com/,,"Dropifi provides a customized smart widget that allows companies to analyze, discover and re-channel messages. "Kidblog,http://kidblog.org/,,Kidblog provides teachers with blogging tools to help their students navigate safely through the online digital landscape. Flyer,http://flyer.io/,,The future of real estate marketing Audiodraft,http://audiodraft.com/,,Audiodraft helps companies outsource their music and audio production to a global community of sound designers and music composers. Markerly,http://markerly.com/,,Markerly is a content agency collecting and analyzing user-generated data to create custom content for company blogs. AirSeed,http://airseed.com/,,"Airseed is the trusted online platform that helps users save money traveling, by automatically tracking and notifying users of price changes, offers, and insights about their own b "Dropsuite,http://dropsuite.com/,,"Dropsuite is a software platform that enables small and medium enterprises to easily backup, recover and protect their digital assets. "AppSocially,http://appsocial.ly/,,"AppSocially provides an API for mobile apps to integrate customer-acquisition functions into it, and keep track of customer viral metrics. "Grata,http://grata.com/,,Cross-Platform Mobile Messaging Console Konnect-I,http://konnecti.com/,,Konnecti is a web platform where small and medium enterprises rate the companies with which they do business. Equipboard,http://equipboard.com/,,Equipboard is building the world's largest database of artists and the gear they use. Whale Path,http://whalepath.com/,,"Whale Path is a Crowdsourced Market Intelligence Platform where over 13,000 analysts compete through research challenges to provide customers with proprietary and reliable market d "Remark,http://remarkhq.com/,,Collaborative Video Annotation Guidekick,http://guidekick.co/,,App for Historical Attractions Roam and Wander,http://roamandwander.com/,,Roam & Wander is a kid's entertainment studio. HumTap,http://humtap.com/,,Humtap - make music with your voice Pangea,http://getpangea.com/,,Developing technology for the 3 billion mobile subscribers without internet. Lean Startup Machine,http://leanstartupmachine.com/,,Learn Startup Machine offers an intensive three-day workshop that teaches entrepreneurs and innovators how to build disruptive products. Abbeypost,http://abbeypost.com/,,Software-driven custom apparel that fits every woman's shape and size. FlyData,http://flydata.com/,,FlyData offers data integration to Amazon Redshift and other big data warehousing platforms. BioFab,http://biofab.com.pe/,,"BioFab is a biotechnology company that provides printing services prosthesis, tissues, and organs. "RocketJourney,http://rocketjourney.com/,,The smartest & friendliest way to a fitness lifestyle. Nuvelar,http://nuvelar.com/,,Nuvelar CMS is a cloud based Digital Signage Content Management System. Unbisne,http://unbisne.com/,,Online distribution of second hand clothing. Apsalar,http://apsalar.com/,,"Apsalar provides leading solutions in mobile app tracking, measurement, and audience management. "Tapshot,http://videokits.com/,,Guided Mobile Video Creation Sproutkin,http://sproutkin.com/,,Sproutkin is a subscription service for children's books allowing parents to receive shipments of new books on a regular basis. Synapp.io,http://synapp.io/,,Helping email marketers get and stay in compliance with their Email Service Providers OnePageCRM,http://onepagecrm.com/,,Web-based Sales App for Small Business WorldShop,http://worldshop.com/,,"Offers international buyers: Fair Prices, Free Shipping and a World Changing mission "LIMK,http://limk.com/,,"Limk is a content distribution and a discovery platform, helping websites grow traffic while reaching highly engaged audiences. "eCommHub,https://hublogix.com/,,HubLogix provides ecommerce order automation solutions that improve profit margins and increases customer satisfaction. Vontrip,http://vontravel.com/,,"VONTRAVEL, based in Argentina, is a flash sale site exclusively for trips and getaways. "Aiotra,http://aiotra.tv/,,Aiotra is a social web platform that enables individuals to add to and share crowdsourced video content. Cloud Admin,http://cloudadmin.mx/,,Cloud solution to easily and efficiently keep track of inventory. eTraining,http://etraining.mx/,,Online Learning with Experts. Iron Drone,http://irondroneinc.com/,,Iron Drone is a visionary company developing and selling telepresence technology UWisio,http://desdeelring.com/,,"Community for boxing fans, with fights information and engaging activities "Noonswoon,http://noonswoonapp.com/,,Noonswoon provides mobile dating services for singles in Asia. TaskRabbit,http://taskrabbit.com/,,TaskRabbit is a website and mobile app that allows users to outsource small jobs and tasks to people in their neighborhood. Jeeran,http://jeeran.com/,,Jeeran is a local review site helpingusers interact better with places in their city. Hacker Earth,http://hackerearth.com/,,"HackerEarth helps you hire great programmers, the smart way. HackerEarth provides a SaaS application to do automated assessment of "WillCall,http://getwillcall.com/,,WillCall is a music discovery and ticketing application that allows users to reserve and book tickets for music events held in U.S. cities. Plancast,http://plancast.com/,,"Plancast is social event sharing site which allows users to discover, plan, promote and celebrate events of interest. "Speek,http://speek.com/,,"Speek enables conference calling by using a unique web link instead of dial-ins, PINs or downloads. "MyGola,http://mygola.com/,,Mygola is a platform enabling travelers to discover customizable and bookable travel itineraries. Hipster,http://hipster.com/,,Hipster is an application enabling users to send photographic postcards to others via iPhone and Android devices. Votizen,http://votizen.com/,,Votizen is a consumer technology company that harnesses social networks to create a connected electorate of voters. VoidBrains,http://superganadero.com/,,Track and improve your swine farming experience. Mytips,http://mytips.co/,,An online platform for building interactive on-screen tutorials without coding. Fiberead,http://fiberead.com/,,Book translating combine with self-publishing. Edools,http://edools.com/,,Edools is like Wordpress.com for e-learning: we cure the pain of any company willing to manage a full-service e-learning system. Edools takes care of all the complicated stuff: vid Arcturus BioCloud,http://arcturus.io/,,"Arcturus BioCloud, Inc. develops platform for scientists to code, create, share, and execute biotechnology experiments. Its platform provides genetic engineering and prototyping so "Crowdplat,http://crowdplat.com/,,CrowdPlat connects mid-size and enterprise customers to freelance teams Kollecto,http://kollecto.com/,,"Kollecto searches the internet for impressive art and gives you recommendations, based on your taste and budget. "Coach Market,http://coachmarket.com/,,CoachMarket makes it easy for individuals and organizations to connect with top business coaches and corporate training consultants. CoachMarket is the first freelancer marketplace Feesheh,http://feesheh.com/,,Online musical instrument shop; making instruments more accessible and affordable in the Arab world. Empreware,http://empreware.com/,,Empreware helps people to create business plans and execute them. We offer a business planning online application. Uguru,http://uguru.me/,,"uGuru offers on-demand, p2p, course specific tutoring to college students at 1/4 of the market price in minutes. "Gogohire,http://gogohire.com/,,"Gogohire is a hiring marketplace that connects top sales talent with companies.You can quickly and easily develop your profile, and they will contact you within 24 hours. Your prof "Milk and Honey,http://milkandhoneyshoes.com/,,E-commerce focusing the huge market of women's shoes and customization. WalletKit,http://walletkit.com/,,WalletKit is a SaaS-based platform enabling businesses to design and deliver digital passes and tickets to mobile wallets. Keen Print,http://keenprint.com/,,Keen Systems is a cloud-based platform that allows companies to build and deploy an e-commerce driven web presence. SafeShepherd,http://safeshepherd.com/,,Safe Shepherd is a privacy web service to remove records that violate its usersâ€™ privacy on internet and remove access â€˜Data Brokersâ€™. InSparq,http://insparq.com/,,inSparq helps retailers instantly market and merchandise their trending products. Virect,http://virect.com/,,Virect is a self service marketplace that connects businesses to video creators. Ready For Zero,http://readyforzero.com/,,ReadyForZero creates online financial software for actively managing personal debt and credit. Medialets,http://medialets.com/,,"Medialets is a media ad platform enabling businesses to create, deliver and measure mobile and tablet campaigns. "Unwind Me,http://unwind.me/,,"Massage Made Simple: The best therapists, straight to you, at an affordable price (YC S14) Massage Made Simple: The best therapists, straight to you, at an affordable price (YC S14 "Cambrian Genomics,http://cambriangenomics.com/,,"Cambrian Genomics is a biotechnology company which uses a novel, laser based technique to synthesize DNA. "Sqoot,http://sqoot.com/,,Sqoot is a local deal API that helps developers make money and advertisers gain distribution. Forrst,https://unum.500.co/public/startups,,Forrst is an invitation-only community of developers and designers with a heavy emphasis on critique and quality feedback. The community of 40k+ is heavily engaged (~50% monthly ac Switch,http://switchapp.com/,,Switch is an addictively simple job hunting app that is reinventing the way people find their next job. PeopleFund,http://peoplefund.kr/,,PeopleFund is Korea's first P2P lending platform to partner with a Tier 1 Bank to process all loans through a bank-integrated system Twilio,http://twilio.com/,,"Twilio is a cloud communication company that enables users to use standard web languages to build voice, VoIP and SMS apps via a web API "Makerbot,http://makerbot.com/,,MakerBot Industries creates open source 3D printers. Grab,http://grab.com/,,Southeast Asian taxi booking application that pre-screen drivers and monitors performance Oneforty,http://oneforty.com/,,oneforty is a social business hub that provides buyers with guide for businesses. Ninua,http://ninua.com/,,"Ninua develops social media applications such as Symphony Tools, which helps businesses in managing their social media presence. "Backyard,http://gobackyard.com/,,Backyard is a SaaS provider delivering video marketing and advertising solutions that connect local businesses with customers. eVenues,http://evenues.com/,,eVenues is an online marketplace for office and event space rental and bookings. Fitocracy,http://fitocracy.com/,,Fitocracy is an online fitness community offering games and social networking tools that help members improve their fitness. MeMeTales,http://memetales.com/,,Memetales is a picture book platform for kids that enables publishers to easily add their books into mobile devices. Maker.me,http://maker.me/,,A platform to showcase and discover Makers. Hunie,http://hunie.co/,,Hunie is an invite-only community for designers to collaborate by giving each other constructive critiques that help improve their work. VaiVolta,http://vaivolta.com.br/,,VaiVolta is an online platform that helps construction companies to rent and manage equipment and machines. Zootrock,http://zootrock.com/,,"ZootRock generates engaging content for posting to your social media accounts. 80% of your content on social media should be about other people, but figuring out what to say and sh "Teaman & Company,http://teamanco.com/,,Teaman & Company are the colored gemstone people - providing remarkable engagement rings and custom jewelry. They marry modern technology & 3D printing with the finest gemstones an Edukart,http://edukart.com/,,"EduKart is India's leading education marketplace offering 2000+ degree, diploma, certificate, entrance coaching & K12 courses. "NinjaBlocks,http://ninjablocks.com/,,Next generation control of your environment with accurate in-home location data and a gesture control interface. Hazel Lane,http://hazellane.com/,,"Hazel Lane travel subscription box. Discover the US through locally crafted, artisanal goods. "PixelFish,http://pixelfish.com/,,PixelFish is a provider of video advertising solutions for small and medium-sized businesses. Affinity China,http://affinitychina.com/,,Affinity China is a Chinese private social network providing its members with exclusive luxury lifestyle and travel opportunities. TheIceBreak,http://theicebreak.com/,,"Theicebreak is an online portal that helps couplestrack, analyze and enjoytheir romantic relationships. "SchoolAdmissions,http://schooladmissions.in/,,SchoolAdmissions is a platform that helps parents choose the right school and manage the admission process for their kids. Wittlebee,http://wittlebee.com/,,"Wittlebee is a kids' clothing company offering custom packages based on a child’s age, color preferences, and geographic location. "Fi.TT,http://fi.tt/,,Fitt is all about movement and motivation. 37Coins,http://37coins.com/,,"Bitcoin wallet provider that created bitcoin technologies for emerging markets such as the Philippines and Singapore, where access to smartphone and desktop PC apps is limited. "SkillBridge,http://skillbridge.co/,,Skillbridge gives clients on-demand access to a 'hidden market' of top-tier Elite Business Freelancers. Taamkru,http://taamkru.com/,,Taamkru is well-known for its eponymous website and smartphone app. Glints,http://glints.com/,,Glints is an internship portal for companies and youths to find each other based on their skills and personality. InnerSpace,http://innerspace.io/,,"Like GPS does outdoors, our instant mapping and location platform transforms the human experience indoors and captures the data on how people interact indoors.  "Junomedical,http://qunomedical.com/,,Junomedical connects patients with doctors abroad SureBids,http://suregifts.com.ng/,,"SureBids is a retail voucher aggregator and provider in Africa. It is the first coordinated effort to introduce retail vouchers in Nigeria, with the focus is on ease of redemption "Indemand,http://tryindemand.com/,,Indemand lets anyone create an ondemand business in minutes. AISense,http://www.aisense.com/,,"AISense improves enterprise productivity with Ambient Voice Intelligence, a unique approach to speech recognition and deep learning. "FinCheck,http://fincheck.com/,,Adam (by FinCheck.com) is an intelligent assistant that makes business finances a breeze. Deenty,http://www.deenty.com/,,TOTAL DENTAL DIGITAL MARKETING SYSTEM Put your practice in front of more patients and turn them into customers with our all-in-one digital marketing system that combines powerful t ChangeJar,http://changejar.com/,,ChangeJar is the first of its kind: a mobile cash payment platform designed with both merchants and customers in mind. ChangeJar has no transaction fees and is convenient for custo Check I'm Here,http://checkimhere.com/,,"Check Im Here gives Universities & Colleges the power to Manage, Track, Assess, & Engage students & organizations on campus. "O.school,http://www.o.school/,,Invite-only streaming platform for pleasure ed Fastwork,https://fastwork.co/,,A marketplace for freelancers Parcel Perform Pte. Ltd.,https://www.parcelperform.com/,,"Parcel Perform is a carrier independent parcel tracking service for merchants worldwide, allowing them to manage their customers' after-purchase experience. "UseTrace,http://usetrace.com/,,"Usetrace's artificial user learns and goes through the critical use cases of any webapp, every time developers make changes. "LittleFund,http://littlefund.co/,,Smart savings and financial education tools to help parents secure their childrens' financial futures Tourkrub.co,http://tourkrub.co/,,Tourkrub.co help people find travel package and understand them faster from so many travel agencies in the market.  KolayIK,https://kolayik.com/,,Kolay İK is a Turkish company that provides human resources and personnel management systems. Botanalytics,http://botanalytics.co/,,"Botanalytics helps bot owners to improve their human-to-bot communication with identifying bottlenecks, filtering conversations, and understanding engagement. "Bisu,http://www.bisu.com.tr/,,"Bisu is an on-demand, one-tap mobile water delivery service in Turkey. "WorkGenius,http://workgeni.us/,,"workgeni.us is a scheduling and support platform for hourly workers, which enables users to find and optimize work across multiple employers, primarily within the on-demand economy "tagMonkey,http://tagmonkey.co/,,"TagMonkey is a platform to make RFID and IoT simple to use and develop for. Users can deploy hardware, connect it to the cloud, and start to plug into applications. "Leapcure,http://leapcure.com/,,"Leapcure offers tools for clinical trial patient recruitment, engagement, and retention. "Movielala,https://movielala.com/,,MovieLaLa is a totally redesigned social platform for movie lovers.  Plum,http://withplum.com/,,Plum is your personal savings assistant — it monitors your daily spending and automagically sets money aside that you won't need. Because saying “#yolo” is a bit too tempting somet Pvgna,https://pvgna.com/,,Pvgna is Netflix for Gaming: a subscription based platform for exclusive and high-quality gaming videos. Metro Residences,http://metroresidences.sg/,,"Largest & most trusted corporate serviced apartments in Singapore, Tokyo and Hong Kong. Stay in over 1000 tastefully furnished apartments 40% more affordable! "Backstartup,http://backstartup.com/,,"BackStartup are revolutionizing the way accounting and legal services are being provided to startups, micro and small enterprises. "Massive Bio,http://massbio.io/,,Massive Bio provides cutting edge concierge advisory services for precision oncology (targeted therapies and immunotherapies) to cancer patients either directly or through channel 