portfolio	website	year	summary		Cobalt	https://cobalt.io	Jan-15	An Application Security Marketplace. We Source Security Researchers From Around the World and Connect Them With Businesses. Crowd-Powered Security Audits and Bug Bounty Programs.		LaunchDarkly	http://launchdarkly.com/	Jan-15	Modern Product Managment Platform to Manage and Optimize Software.		MoEngage	http://www.moengage.com/	Jan-15	Marketing Automation Platform Pioneering User-Level Personalization Solving the Problem of Churn in Mobile Apps.		NanoPay	https://nanopay.net/	Jan-15	Next-Gen Payments Platform for Online and Retail. Secure Fast and Lower Cost.		OneMob	https://www.onemob.com/	Jan-15	Real-Time Messaging and Engagement Platform for Mobile SaaS.		Pareto Biotechnologies		Jan-15	Synthetic Biology Platform to Generate “Designer Molecules.”		Scoro	http://www.scoro.com/	Jan-15	The Ultimate Control Hub for Companies to Access Manage and Automate Data Across Existing Productivity CRM and Billing Applications.		WorkHands	https://www.workhands.us/	Jan-15	The Blue Collar Web.		Zipline	http://www.retailzipline.com/	Jan-15	SaaS Solution that Drives Sales for National Retailers by Improving the Actionable Communication Between HQ and the Stores. Based on 10 Years of Research and Testing Around Store Operations and Performance.		3TEN8	http://www.3ten8.com/	Sep-14	Autonomous Networks. Using ML and AI to automate network operations.		Featherlight	http://www.featherlight.co/	Sep-14	Performance Coaching Platform That Measures & Improves Employee Performance in Real-Time.		Freedcamp	https://freedcamp.com/	Sep-14	Web-Based Collaboration Platform that Consolidates Multiple Tools in One Place Under A Freemium Model.		Groove	http://www.grooveapp.com/	Sep-14	Quantified Sales. Groove Enables Companies to Collect Relationship Data and Use it to Improve Every Customer Interaction.		Ladera Labs	http://www.laderalabs.com/	Sep-14	Internet-of-Things Company Focused on Home Automation (Nest for Irrigation).		MindOps	http://mindops.com/	Sep-14	MindOps is the OS for Recognition on iOS Android Glass. We Have Created the First Deep Learning Based Neural Network for Text.		Perfect Price	http://perfectprice.io	Sep-14	Price Optimization-as-a-Service Leveraging State of the Art Machine Learning.		Tyche	http://www.tycherisk.co/	Sep-14	Machine Learning / Artificial Intelligence Legal Claim Valuation.		Xendo	https://xen.do/	Sep-14	Cloud Search for Business.		3DPrinterOS	http://www.secured3d.com/	May-14	First to Market – 3D Printing Cloud platform with Copyright Encryption and Centralized Command and Control.		BadgerMaps	https://www.badgermapping.com/	May-14	Mobile Service that Helps Sales People Fit More Meetings into their Day While Increasing the Flow of Data Back into their Company’s CRM System.		Domos Labs	http://www.domos.no/	May-14	Cloud-based Software for WiFi Routers that Make Connected Home Technology Seamless and Invisible.		Eventable	https://eventable.com/	May-14	Building the Event Layer for the Web. Our Tools and APIs Enable Brands and Organizations to Send Events to Any Calendar.		Matternet	http://mttr.net/	May-14	UAV Networks for the Transportation of Goods.		Mavin	http://www.mavin.co/	May-14	Digital Media Platform That Enables Low Cost Mobile Data Plans for Prepaid Smartphone Users.		NeoReach	https://neoreach.com/	May-14	NeoReach Allows Enterprise Companies to Scale Influencer Marketing Programs. Advertisers Can Buy Traffic Directly from Influencers Using A Cost-Per-Click Model.		Oomnitza	https://www.oomnitza.com/	May-14	Mobile First Enterprise IT Asset Management Solution Focused on the Emerging Connected World That Helps Companies Better Track IT Assets and the Information on Them.		ShoppinPal	http://www.shoppinpal.com/	May-14	Embeddable M-Commerce Platform that Captures Lost Sales for Brick & Mortar Retailers.		SupplyBetter		May-14	Custom mechanical part sourcing. Simplified		Waygum	http://waygum.io/	May-14	Waygum Offers an End-to-End Mobile App Platform for the IOIT (Internet of Industrial Things or Industrial Internet).		AppSlingr		Jan-14	Brings Seamless Access to Desktop Apps from the Web Mobile or Tablet Devices and Integrates with Cloud File Storage Systems.		Assemblage	http://www.cisco.com/web/about/ac49/ac0/ac1/ac259/assemblage.html	Jan-14	Real-time Collaboration with Extremely Simple One-Click Tools: Kollaborate.io Presentation.io and Same.io.		CirroSecure		Jan-14	Public Cloud Data Security Monitoring Analytics and Risk Remediation for Fortune 5000 Enterprises.		Drone.io	https://drone.io/	Jan-14	Automated Software Delivery Using Docker.		Frontleaf	https://www.frontleaf.com/	Jan-14	Actionable Insights To Reduce Customer Churn In The Subscription Economy.		Mohound		Jan-14	App Marketing Platform With ROI Analysis And Integrated Big-Data Analysis For Automated Decision Making.		PathDrugomics	http://www.pathdrugomics.com/	Jan-14	Simulation Testing And Predictive Analytics PaaS For Early Stage Medical And Chemical Research.		Peer.im		Jan-14	Enterprise Messenger For Your Team And Your Customers.		Placements	http://placementsapp.com/	Jan-14	Painless Premium Ad Platform For Publishers.		rENIAC	http://www.reniac.com/	Jan-14	Solve Customer’s Need For Real-Time Analytics (FAST BIG DATA) By Moving Their Current Batch Processing To Real-Time Online Processing.		Sense.ly	http://sense.ly/	Jan-14	Patient-frendly Tool That Helps Clinicians Better Manage Their Chronically Ill Patients.		Upshot		Jan-14	The Only Mobile Reporting App That Allows You To *Create* New Reports On Your Mobile Device.		Airpost	http://www.airpost.io/	Sep-13	Cloud Security Management		BrightFunnel	http://www.brightfunnel.com/	Sep-13	“Splunk for CMOs” – Revenue Insights Across Marketing & CRM Data.		Discover.ly	http://discover.ly/	Sep-13	A Tool to Discover Opportunities in Your Connections Both Personal and Professional.		MXD 3D	http://mixeddimensions.com/	Sep-13	Developing a Cross-Platform Modeling Tool for 3D Printing.		NextInput	http://www.nextinput.com/	Sep-13	3D Touch Technology for Next-Generation User Interfaces.		Omnistream	http://omnistream.co	Sep-13	Mobile CRM for Luxury Retailers in China.		Skurun	http://skurun.com/	Sep-13	Monetize Retail Surfaces.  Ad Exchange Connecting Advertisers with Retail Surfaces.  Leverages Mobile and Realtime Bidding.		Synata	http://synata.com	Sep-13	World’s First Enterprise Cloud Search Engine.		Group Tie		May-13	Creating Group Relationship Management (GRM) to Help Enterprises Manage Large External Networks of People.		HealthCrowd	http://www.healthcrowd.com/	May-13	Mobile Salesforce.com for Healthcare.		MindHelix		May-13	GPS-Based Mobile Security Application Helping Individuals Institutions and Governments Prevent Crime and Ensure Persistent Safety.		PlayVox	http://www.playvox.com/	May-13	Gamification Platform for Call Centers. Learning Coaching and Performance Platform Designed to Manage and Motivate People at Call Centers.		Relink	http://relink.no/	May-13	Mobile Contact Management Solution		Seva Coffee	http://www.sevacoffee.com/	May-13	Personalized Coffee – Hardware and Cloud Software Solution to Disrupt the Global $100B/yr Coffee Market and Create a New Consumer Coffee Drinking Experience Where Every Cup of Coffee is Personalized to Every Consumer. The Best Cup of Coffee Created by You to Your Taste.		Wise.io	http://about.wise.io/	May-13	Machine Intelligence Solutions for Big Data Enterprise.		Chronon Systems	http://chrononsystems.com/	Mar-13	Flight Data Recorder Technology that Captures the Entire Execution of JVM and Replaces the Need for Traditional Log Files.		Eduora		Mar-13	Learning Management System Focused First on the End-User: Unifying Disparate Campus Applications in One Interface Building Enterprise-Class University Products that Users Love.		MightyHive	http://mightyhive.com/	Mar-13	Consumer Marketing Automation – Automates Optimizes and Measures Advertising Cross-Channel Using Data that is Only Available to an Enterprise Class Application.		Purple	https://i.likepurple.com/	Mar-13	Mobile Customer Engagement Platform that Enables Businesses to Acquire and Engage Customers by Leveraging Apple’s Passbook and Other Upcoming Mobile Wallets.		Sourcery	https://getsourcery.com/	Mar-13	Simplifying Sourcing and Ordering for Food Businesses. We Are Replacing Legacy Enterprise Software Systems with User-Friendly Cloud-Based and Mobile Applications Bringing the Food Industry into the 21st Century.		Stratio	http://www.stratiotechnology.com/	Mar-13	First Portable Infrared Sensors at >1000x Lower Cost >6 Orders of Magnitude Lower Power and >4x Higher Resolution than Current Technology Enabling Personal Health Monitoring in Smartphones.		Tylr	http://www.tylrmobile.com/	Mar-13	Enterprise-Ready Mobile Work Platform Connecting Familiar Tools Like Email With Relevant Data and Processes in Your Business.		Zipongo	http://www.zipongo.com/	Mar-13	Payors Subscribe Members for Personalized Meal Plans Savings on Healthy Groceries and Rewards for Buying ‘GO’ Foods.		ActiveScaler	http://activescaler.com/	Jan-13	Provides A Real-Time Secure and Scalable Connected Car Platform & API for Developers to Build Amazing Applications.		Cambrian Genomics	http://cambriangenomics.com/	Jan-13	DNA Laser Printer for Genome (Life) Synthesis.		Connect Bright		Jan-13	Advocacy Empowerment Platform for B2B Service Providers.		Jy Mob	http://jymob.com/	Jan-13	Platform to Choose the Best People for Your Jobs.		MobileSpan	http://www.mobilespan.com/	Jan-13	Drop-In BYO Platform for Enterprises.		Selligy		Jan-13	Mobile Service Helping Salespeople with their Primary Activity – Sales Meetings.		Send Task	http://getsendtask.com/	Jan-13	Next Gen Enterprise Task Management.		Social Pandas	http://www.socialpandas.com/	Jan-13	Social Selling Platform – Find & Close Sales Deals Faster via Social Networks.		Xockets	http://xockets.com/	Jan-13	Licenses Software and Hardware Designs Producing Scalable Faster and Future-Proof Data Centers for Machine Learning and Analytics.		