profolio,website,year,summaryAmbition ,http://ambition.com/,w2014,"Performance management for the Millennial workforce. Transparency, accountability, motivation around daily activities to drive long-term results."AptDeco ,http://aptdeco.com/,w2014,AptDeco is a peer to peer marketplace for buying and selling furniture. Delivery included!Avametric ,http://www.avametric.com/,w2014,Simulate clothes on your body.Awesometalk,,w2014,Free video calling without the hassle.Bellabeat ,http://bellabeat.com/,w2014,Fashionable wellnessBoostable ,http://boostable.com/,w2014,Advertising platform tools for marketplace sellers.Cambly ,http://cambly.com/,w2014,On-demand access to English tutors over video chat.CareMessage ,http://caremessage.org/,w2014,Patient engagement using text messagingChargehound ,https://www.chargehound.com/,w2014,Automate your chargeback dispute process.CodeCombat ,https://codecombat.com/,w2014,Multiplayer programming game that teaches Python and JavaScript to kids 8-18.CodeNow ,http://codenow.org/,w2014,Our mission is to diversify the talent pipeline of students who pursue computer science and technology. We do this by providing free out-of-school computer programming training to students hosted at tech companies.Cruise ,http://getcruise.com/,w2014,Self-driving cars.Dating Ring ,https://www.datingring.com/,w2014,In person matchmaking meets group dating. We do the work. You go on dates.Drive Pulse,,w2014,Device tracks & monitors your carEdyn ,http://edyn.com/,w2014,Nest for lawn and gardenEmailio ,http://emailio.com/,w2014,Mobile email appEventjoy ,http://eventjoy.com/,w2014,"Fee-free ticketing, optimized for mobile."Flexport ,https://flexport.com/,w2014,"Flexport's mission is to make global trade easier for everybody. We are connecting humanity in a seamless web of global trade with our unique blend of software, human expertise, and physical infrastructure."Framed Data ,http://www.framed.io/,w2014,Predicted churn for enterprises. Acquired by Square in March 2016.Futureleague ,http://www.futureleague.co/,w2014,"Engineering and Programming for Kids 6-12 with a focus on creativity, teamwork, and design thinking. In private beta, in-person, soon to be online"GBatteries ,http://gbatteries.com/,w2014,Enabling li-ion batteries to charge ultra fast without compromising cycle life.Gobble ,http://gobble.com/,w2014,"Daily meal delivery, personalized to your tastes."Guesty ,http://www.guesty.com/,w2014,The management platform for the short term rental industryHoverChat,,w2014,Message without interrupting what you're doingImmunity Project ,http://immunityproject.org/,w2014,The free HIV vaccine.Kimono Labs ,http://kimonolabs.com/,w2014,Create APIs where they don't exist. With kimono you can quickly extract unstructured data from websites and turn it into clean APIs to use in your applications and services.Kuna Systems ,http://getkuna.com/,w2014,"We're making a smart, front door camera with intercom that lets you answer your front door from anywhere in the world, and see who's coming and going at your house."Liftigniter ,http://liftigniter.com/,w2014,"Machine Learning personalization for dynamic digital properties - predict user impression actions in real-time. 80%+ average improvements in conversion, CTR, and engagement within 7 days. Billions of page views/mo served."MadeSolid,,w2014,Functional 3D printing materials.Memebox ,http://memebox.com/,w2014,Full Stack Beauty EcommerceMerryMint ,http://merrymint.co/,w2014,The best local food & drink delivered for office celebrationsMixerBox ,http://mixerbox.com/,w2014,Unified Music PlayerMotionlead ,http://motionlead.com/,w2014,Animated mobile ads.Move Loot,,w2014,Move Loot is the most convenient and economical way to buy and sell used furniture online.Next Caller ,http://nextcaller.com/,w2014,"Advanced Caller ID for Businesses | We provide the name, address, and email of your inbound callers."Noora Health ,http://noorahealth.org/,w2014,Training patient families with health skills to improve outcomes and save lives.One Degree ,http://1degree.org/,w2014,"One Degree is a nonprofit organization that makes it easy for low-income and at-risk families to find and access the vital services and benefits they need for social and economic mobility. Click ""Contribute"" to help us scale our work."OpenCurriculum ,http://opencurriculum.org/,w2014,Helping K-12 teachers and school administrators build awesome curriculum.Orankl ,http://orankl.com/,w2014,Ecommerce infrastructure as a service.PiinPoint ,http://piinpoint.com/,w2014,PiinPoint tells retail businesses where to place their locations to maximize return on investment.Povio ,http://poviolabs.com/,w2014,We build software for the best* startups in the world. We do it faster and cheaper than if they would have built it by themselves. Our speciality is that we can start right away. Search Bookface for testimonials from our clients. *YCPushBullet ,http://pushbullet.com/,w2014,Push things to your other things.Rickshaw ,http://gorickshaw.com/,w2014,"Same day local delivery, via API. Currently operating in SF."Rocketrip ,http://rocketrip.com/,w2014,Rocketrip helps companies save money on travel expenses by aligning employee interest with company policy.Sendwithus ,http://sendwithus.com/,w2014,"Turn your email provider into a growth marketing platform. Templates, A/B Tests, Drip Campaigns, Segments, and Analytics for Mailgun, SendGrid, Mandrill, and SparkPost."Shoobs ,http://shoobs.com/,w2014,We help you find and book tickets to great entertainment events that match your taste.Shopagram ,http://shopagram.co/,w2014,Next Generation Home Shopping NetworkSketchDeck ,http://sketchdeck.com/,w2014,Design on demandSnapdocs ,http://snapdocs.com/,w2014,"We are tackling the massive mortgage market, bringing security, efficiency, and joy to a paper-based pillar of the US economy."StackLead,,w2014,Lead intelligence as a service. We want to be your personal lead consultants--email us at founders@stacklead.com and we'll help you generate and prioritize leads.Stride API ,https://www.stride.io/,w2014,"Stride is a realtime analytics API that enables developers to collect, process, and analyze streaming data without having to manage any underlying data infrastructure."Style Lend ,http://stylelend.com/,w2014,P2P dress rental.Taplytics ,http://taplytics.com/,w2014,We make your native mobile interface completely dynamic. So you can react to your analytics and optimize your native mobile app in real-time.Terravion ,http://terravion.com/,w2014,Real time Google Earth for agriculture -- imagery collected weekly during the growing season by our aircraft. TerrAvion collects >100x more mapped area in any week/month than the whole electric drone industry combined.Theorem LP ,http://theoremlp.com/,w2014,"Theorem conducts independent underwriting of consumer loans originated by banks, credit cards companies and other lenders. We utilize this information to manage institutional capital and advise loan securitizations."Threadable,,w2014,Mailing lists 2.0. Threadable makes group email less noisy and more actionable.TradeBlock ,http://tradeblock.com/,w2014,Digital currency data and analysisTrueVault ,http://truevault.com/,w2014,"TrueVault is Fort Knox for data. A Backend-as-a-Service built specifically with data security in mind, TrueVault is the secure data store for products in healthcare, finance, consumer electronics and IoT."Two Tap ,http://twotap.com/,w2014,"Two Tap connects retailers to companies that want to sell their products, in apps or sites, domestic or internationally Two Tap Crossborder is risk-free for retailers and it allows anyone outside of the US to order products from 1000s of US stores"Unbabel ,http://unbabel.com/,w2014,AI Powered Translation as a ServiceUnicornly,,w2014,"Unicorn.ly makes fundraising more efficient for both angel investors and entrepreneurs. For angels, Unicorn.ly brings deal flow and a community of experts. For companies, Unicorn.ly helps attract investors and lead them efficiently toward a close."Vidpresso ,http://vidpresso.com/,w2014,"We help media companies, brands and celebrities create high quality broadcasts for Facebook Live."Weave Communications ,http://getweave.com/,w2014,Patient / Doctor communication.Whirlscape ,http://getdango.com/,w2014,Mobile keyboards + emoji + deep learning. We make Dango. We also made the Minuum keyboard.Wit.ai ,http://wit.ai/,w2014,Natural Language for Developers -- Wit is an API that makes it easy for developers to create apps that you can talk and text to. It turns speech or text into actionable data.Yumbin,,w2014,App replaces office vending.Zesty ,http://zesty.com/,w2014,"Zesty serves delicious, healthy meals from the best local restaurants to your office."Zidisha ,http://zidisha.org/,w2014,Direct P2P lending across the international wealth divide.Zinc ,http://zinc.io/,w2014,The secret backbone of e-commerce. The Zinc API knows all products for sale on the internet and lets you buy them.ZowPow,,w2014,Wireless toy game controllers for mobile games.7cups ,http://7cupsoftea.com/,s2013,7 Cups is an emotional support service that matches up people that need support with active listeners and therapists.Amulyte,,s2013,Remote monitoring & activity tracking system for seniors.Apptimize ,http://apptimize.com/,s2013,"Apptimize lets mobile teams innovate faster to create an amazing user experience. Our tech lets you instantly update your native Android and iOS apps for A/B testing, feature flagging, and changes without having to go through the App/ Play Stores."Arcus (formally regalii) ,http://arcusfi.com/,s2013,API for payments anywhere in the worldAsseta ,http://asseta.com/,s2013,Marketplace for industrial spare parts and capital equipment.Audobox,,s2013,Audobox is a developer and user friendly tool for in-app feedback.BloomThat ,http://bloomthat.com/,s2013,Uber for Flowers.Bop.fm ,http://bop.fm/,s2013,Canonical permalinks for songs.Butter Systems,,s2013,Replacing the paper restaurant menu with an interactive experience at the table.Buttercoin,,s2013,Bitcoin MarketplaceCasetext ,http://casetext.com/,s2013,We make the world's laws free and understandable.CoreOS ,http://coreos.com/,s2013,Enterprise Linux distribution that dramatically improves security and speed of application deployment.Cratejoy ,http://cratejoy.com/,s2013,Cratejoy is the platform for subscriptionsCrowdery,,s2013,"[Now Clara, YC S14- claralabs.com]"Datarank ,http://www.datarank.com/,s2013,Making sense of social data. (Acquired by SimplyMeasured.)DoorDash ,http://doordash.com/,s2013,Restaurant delivery.EasyPost ,http://easypost.com/,s2013,Shipping APIEcho Locker ,http://echolocker.com/,s2013,Android lock screenEstimote ,http://estimote.com/,s2013,Indoor location API for developersFloobits ,http://floobits.com/,s2013,"Real-time collaborative editing in the browser with support for Sublime, Vim, and Emacs. Focused right now on remote pair programming."Glio,,s2013,Amazon Marketplace for Latin AmericaGoComm,,s2013,Mobile communications platform for teams working on live eventsGraft Concepts,,s2013,Graft Concepts makes unique iPhone cases and other mobile accessoriesHackermeter ,http://hackermeter.com/,s2013,Replacing resume screening with code challenges.Hum,,s2013,"A chat program that integrates with email, with presence."imHome,,s2013,We're creating technology to make families happier with a messaging app for the familyIxiplay,,s2013,"Engaging, expressive & Android hackable robot buddy for playful interaction."Jerpix,,s2013,"Digital, asynchronous collectible card game."Kivo,,s2013,Git for DocumentsLayer By Layer ,http://layerbylayer.com/,s2013,"Acquired by MakerBot in February 2014. A marketplace for 3D printable products - just like the iTunes app store, but for 3D printing. We don't sell physical products, and we don't sell design files, but rather we sell single prints."Le Tote ,http://letote.com/,s2013,Subscription service for women's apparel & accessories.LocalOn ,http://localon.com/,s2013,Web marketing for SMBs & merchants associations.Lumoid ,http://lumoid.com/,s2013,We are a try before you buy service for consumer electronics.Meta ,http://www.metavision.com/,s2013,Augmented reality glasses.One Month ,http://onemonth.com/,s2013,"One Month's affordable online bootcamps teach people how to code in just one month. Topics include Python, Ruby on Rails, JavaScript, and Front-end Development. For a full list of courses, visit https://onemonth.com/courses."Panorama Education ,https://www.panoramaed.com/,s2013,Data analytics for public schoolsRealCrowd ,http://realcrowd.com/,s2013,Crowdinvesting for Real EstateReebee ,http://reebee.com/,s2013,Flyer app.Senic ,http://senic.com/,s2013,Premium Smart Home DevicesSimpleLegal ,http://simplelegal.com/,s2013,"Legal spend, matter, accrual and IP management software for in-house counsel."SoundFocus,,s2013,We are giving you 20/20 hearing when listening to the devices you already own and love - no hardware required.SpoonRocket,,s2013,Meals Delivered in 10 MinutesStackMachine,,s2013,Instant sandboxed server environmentsStandard Treasury ,http://standardtreasury.com/,s2013,Banking APIs; acquired by Silicon Valley Bank in August 2015StatusPage ,http://statuspage.io/,s2013,The best way to communicate with users around downtime.Teleborder,,s2013,Dashboard for companies to manage immigration for their employees.True Link ,https://www.truelinkfinancial.com/,s2013,Diversified financial services for seniorsURX ,http://urx.com/,s2013,Mobile ads that users like. Acquired by Pinterest in May 2016.Watchsend,,s2013,Videos of your iOS appsWebCake,,s2013,Marketing people modify site.Webflow ,http://webflow.com/,s2013,Dynamic website builder.Weilos ,http://weilos.com/,s2013,Weight loss coaching.Airware ,http://airware.com/,w2013,Airware provides end-to-end solutions that enable enterprises to digitize their business and turn aerial data into actionable business intelligence.Appcubator,,w2013,The easiest way to prototype web applications.BeatDeck,,w2013,"Music, Metrics... Meritocracy. (Upload Music, Connect your Social Media Accounts, Receive Metrics, Perfect Yourself and Predict Success)"Bitnami ,https://bitnami.com/,w2013,The App Store for Server SoftwareBuildZoom ,https://www.buildzoom.com/,w2013,"BuildZoom is a better way to remodel. We connect homeowners to the most reliable general contractors in their area and make remodeling simpler, cheaper and more predictable."Cheetah ,http://restaurantcheetah.com/,w2013,"Cheetah is the fastest, easiest, and most affordable way for small business owners to order their supplies with same day or next day delivery."CircuitLab ,https://www.circuitlab.com/,w2013,Browser-based electronics simulations and schematics software.Coin ,http://onlycoin.com/,w2013,A mobile wallet that allows you to pay everywhere credit cards are accepted.CrowdMed ,http://crowdmed.com/,w2013,CrowdMed harnesses the wisdom of crowds to solve difficult medical cases onlineEtleap ,https://etleap.com/,w2013,ETL for Big DataExperiment ,http://experiment.com/,w2013,funding and collaboration platform for scienceFivetran ,http://fivetran.com/,w2013,Data infrastructure as a serviceFlightCar,,w2013,"FlightCar is the Airbnb of Car Rentals at Airports. We allow people to rent their car out to other travelers while they are gone, so they get free airport parking and make money. Renters get a cheaper rental. We also provide $1m of insurance."Goldbely ,https://www.goldbely.com/,w2013,We make the most regionally famous and downright awesome foods from across the country available for delivery to anywhere in these United States.GrepData ,http://grepdata.com/,w2013,Big Data AnalyticsHeap ,https://heapanalytics.com/,w2013,"Heap automatically captures every user interaction in your mobile or web app, letting you generate analytics without writing code or waiting for data."InfluxData ,https://influxdata.com/,w2013,"InfluxData is building the platform for collecting, storing, visualizing, and processing time series data at scale."Interana ,http://interana.com/,w2013,Hadoop for impatient people.Kalibrr ,http://kalibrr.com/,w2013,"Kalibrr matches people to jobs on the basis of interests, experience and skills and we operate talent marketplaces in Southeast Asia."Lawdingo ,http://lawdingo.com/,w2013,Lawdingo provides virtual paralegal services to law firms.Logiblock,,w2013,Logiblock engineers electronics and development tools to dramatically accelerate your ideas into physical products.Lollipuff ,http://lollipuff.com/,w2013,Online Auctions for Authentic (Women's) Designer GoodsMedisas ,http://medisas.com/,w2013,Medisas builds workflow & collaboration software for hospitals.MedXT ,http://medxt.com/,w2013,"Radiology in the cloud. X-rays, CAT scans, MRI's, and ultrasounds. Acquired by Box in November 2014."Meldium ,http://meldium.com/,w2013,Simple password & identity management for teams. Acquired by LogMeIn in August 2014.Padlet ,https://padlet.com/,w2013,Easiest way to put stuff on the InternetPayTango,,w2013,Simple invoicingPosmetrics,,w2013,Ultra-short feedback surveys on tablets mounted in businesses. Higher response rates allow more powerful data analytics.Prophecy Sciences,,w2013,Predicting workplace performance through neuroscienceRADAR ,https://goradar.com/,w2013,RADAR is building a hardware and software platform for autonomous retail.RoverRide,,w2013,"A universal urban transit app. Given all transportation options available to you, Rover will give you the optimal route choice *right now*, using real-time data for each transit mode."Screenhero ,http://screenhero.com/,w2013,"Collaborative Screen Sharing — you each get your own mouse, and you're both always in control. Acquired by Slack (Jan '15)."Semantics3 ,http://semantics3.com/,w2013,We are building the world's largest database of product and pricing information.SimplyInsured ,http://simplyinsured.com/,w2013,We make it simple to buy health insurance online. Don't get confused by deductibles & coinsurances - we give you straightforward costs for your medical needs.Strikingly ,https://www.strikingly.com/,w2013,"The easiest way to create a beautiful, mobile optimized website."StyleUp,,w2013,"StyleUp brings effortless joy to getting dressed with daily, weather-appropriate advice tailored to suit your life and style."Swapbox,,w2013,Stop missing deliveries. Ship to Swapbox and pick up at our kiosks.Swish,,w2013,Kickstarter for physical products. Shop exclusive product launches.Teespring ,http://teespring.com/,w2013,"Retail quality products on-demand. Teespring is a platform that enables anyone to create and sell unique apparel and items that people love, with no cost or risk."Thalmic ,http://thalmic.com/,w2013,Wearable computing hardware: biosignal gesture recognitionTrainzen,,w2013,Educational assessments made easy. Eliminating paper-based exams in higher ed.VaycayHero ,https://www.vaycayhero.com/,w2013,VaycayHero is a marketplace of professionally managed vacation rentals. Acquired by RedAwning in March 2017.Watsi ,http://watsi.org/,w2013,Watsi is the first global crowdfunding platform for medical treatments.Wefunder ,http://wefunder.com/,w2013,"Kickstarter for equity. We let anyone invest as little as $100 in startups. We connect startups with a ""street team"" of passionate small investors eager to help evangelize."Wevorce ,http://wevorce.com/,w2013,"Changing divorce for good by making it a way less horrible experience for kids, couples and attorneys."Zenefits ,http://zenefits.com/,w2013,"HR for small businesses: onboarding, payroll and benefits."9gag ,http://9gag.com/,s2012,Make the world happier.Airshared,,s2012,TBDAmicus ,http://amicushq.com/,s2012,"Tools for nonprofits and political campaigns that win more donors, more members, and more votes."Arc,,s2012,aerial videographyAssorted Bits,,s2012,A mobile calendar for all the fun stuff you do with friends.BackerKit ,http://backerkit.com/,s2012,BackerKit is crowdfunding software that helps project creators manage their 1000 biggest fans.Benchling ,http://benchling.com/,s2012,Collaboration platform for life science researchBinary Thumb (Grid),,s2012,Redesigning spreadsheets for the mobile worldBoosted ,http://boostedboards.com/,s2012,"Simple, fun, and fast electric vehicles."Bufferbox ,http://bufferbox.com/,s2012,The future of package delivery. We are building a network of automated self-serve kiosks that allow consumers to receive parcels 24/7 from convenient locations. Say goodbye to failed deliveries! Acquired by Google 11/30/2012Canopy Labs ,http://canopylabs.com/,s2012,"Canopy Labs automates customer analytics for small and medium-sized businesses. We are developing a customer data platform which provides product recommendations, propensity models, and marketing funnel analytics."Celery ,https://trycelery.com/,s2012,Celery is a platform for pre-orders (www.trycelery.com). Accept pre-orders easily and crowdfund on your own website.Clever ,https://clever.com/,s2012,Developing applications for education is a data nightmare. Clever's APIs make building on top of student data easy for developers.Coco Controller,,s2012,We're building a tactile gaming controller for mobile phones.Coinbase ,http://coinbase.com/,s2012,The most popular place to buy and sell digital currency 🚀 🌑Collections,,s2012,Finder for the CloudCredictive,,s2012,Attribution metatags for online content.Crohnology ,http://crohnology.com/,s2012,We turn Patients into Researchers. We empower every patient with tools to contribute towards research for their cure.DataNitro,,s2012,We speed up Excel.Double Robotics ,http://doublerobotics.com/,s2012,Telepresence robotsDreamforge,,s2012,Simple 3d modeling software for 3d printers.Easel ,http://easel.io/,s2012,"Easel is a visual design tool built for the web. Since the web is viewed in a browser, we believe it should be built in one too."Eligible ,http://eligible.com/,s2012,Healthcare Eligibility APIEveryday.me ,http://everyday.me/,s2012,Everyday.me - Record your life. Store it forever.FileStack,,s2012,"Acquired by Xenon Ventures. We enable website developers to hook into various online content sources (Dropbox, Facebook, Github, Gmail, et. al) with a single line of javascript. Thinking of dealing with files or Oauth? Talk to us first."Flightfox ,http://flightfox.com/,s2012,"Flightfox is a human-powered travel management service. We use deep technical analysis to maximize savings, convenience and comfort for companies and individuals. We also specialize in optimizing company spending and loyalty benefits."Framebase,,s2012,API for video.Fullstack Academy ,http://fullstackacademy.com/,s2012,"Immersive, effective, efficient code education."FundersClub ,http://fundersclub.com/,s2012,Online VCGetGoing,,s2012,"We are building a ""transparent opaque"" airfare and hotel booking site -- we work with a number of top airlines and hotels to offer discounted airfare and hotel rates (think Priceline's Name Your Own Price) without hiding the details of the booking."GoScale,,s2012,Server Management as a ServiceHealth Sherpa ,http://healthsherpa.com/,s2012,Private sector Healthcare.gov.Hipset,,s2012,The best way for artists to release new music and videos.Hiptype,,s2012,"Hiptype is a marketing and analytics platform for eBooks. We can visualize where in a book readers most often annotate and highlight, and where they lose interest and stop reading."Human Dx ,http://humandx.org/,s2012,The Human Diagnosis Project.Imgfave,,s2012,A fun image sharing community.Instacart ,https://www.instacart.com/,s2012,Groceries delivered fast.Kamcord ,http://kamcord.com/,s2012,Keychain Logistics,,s2012,Software that connects the supply side of companies that ship product with independent carriers that move product.Kippt,,s2012,Kippt is like GitHub for your online information. We help you to build your and your team's professional library of online resources.Knowmia ,http://knowmia.com/,s2012,Pandora meets Yelp for K-12 educational videos. We match each student with the best teachers for their individual learning style to help them grasp key concepts for school.LeanMarket,,s2012,Mobile advertisingLever ,http://lever.co/,s2012,Lever is an Applicant Tracking System + Talent CRM. It effortlessly fits the hiring needs of companies today.Light Table/Eve,,s2012,"Eve is our way of bringing the power of computation to everyone, not by making everyone a programmer but by finding a better way for us to interact with computers"Markupwand,,s2012,TBDMattermark ,http://mattermark.com/,s2012,"Big Data Meets Startup Investing The best tool for tracking and benchmarking more than 200,000 startups from around the world."Mattermost ,http://mattermost.com/,s2012,"Open source, self-hosted Slack-alternative"MicroEval,,s2012,"Changing the way companies review employee performance with quantitative, short, easy-to-do evaluations."Mth Sense ,http://mthsense.com/,s2012,We're a mobile on-device profiling and ad-serving platform initially focused on in-app ads. We profile the user based on device data but ensure user privacy by keeping the data on-device.Natero ,http://natero.com/,s2012,Data-driven customer success platform for B2B SaaS.NewsBlur ,https://www.newsblur.com/,s2012,NewsBlur is a personal news reader that brings people together to talk about the world. A new sound of an old instrument.OctaveWealth ,http://octavewealth.com/,s2012,The honest 401(k). Helping employees keep more of their retirement savings.