profolio,website,year,summaryUpKeep Maintenance Management ,http://www.onupkeep.com/,w2017,"We make beautiful, easy to use mobile software for maintenance teams""Veryfi, Inc. ",https://www.veryfi.com/,w2017,"Veryfi automates the boring parts of your accounting (receipt data entry, vehicle logbook, ledger categorization & bank reconciliation) with AI, OCR and machines, not humans. YC only 3 Months FREE deal => https://hub.veryfi.com/startups/YCDEAL17"Vinsight ,https://www.vinsight.co/,w2017,We are building the world's real-time source of commodities supply through yield forecasts on crops.Vize Software ,http://www.vize.io/,w2017,Vize is a SaaS solution that helps engineers perform data exploration for predictive maintenance and production optimization. It includes everything from data preparation to advanced statistical tools in an easy to use visual interface.VoiceOps ,https://voiceops.com/,w2017,VoiceOps is a platform for analyzing enterprise voice. Our mission is to provide easy access to customer conversations. Our product analyzes sales and support conversations and generates insights on phrases that maximize success.volans-i ,http://www.volans-i.com/,w2017,B2B on-demand delivery service for time-critical shipments using high-speed long-range drones.Volt Health ,http://www.ycombinator.com/companies/www.volthealth.com,w2017,"Volt Health is developing medical devices that deliver electrical stimulation to the muscles of the body to treat disease, starting with urinary incontinence."Voodoo Manufacturing ,http://www.voodoomfg.com/,w2017,"AWS for manufacturing. Our robotic 3D printing factory can make 1-10k plastic parts in less than 2 weeks, at injection molding prices."Wavy ,http://downloadwavy.com/,w2017,We make augmented reality experiences for musicians.WaystoCap ,https://waystocap.com/,w2017,We are Alibaba of Africa. We are building a marketplace for African businesses to buy and sell products giving SMEs access to commerce.Wifi Dabba ,http://wifidabba.com/,w2017,Wireless ISP in India.Wright Electric ,http://www.weflywright.com/,w2017,Boeing for electric planesXIX.ai ,http://xix.ai/,w2017,XIX uses AI to make your phone predict what you want before you even askZestful ,https://zestful.com/,w2017,"The easiest way for companies to give individualized perks to their employees. Give perks like Spotify, Netflix, Blue Apron, Corepower Yoga, StubHub and hundreds more - all without a painful reimbursement process."Airfordable ,http://www.airfordable.com/,s2016,Buy your flights for a deposit upfront and pay off the rest in installments before your departure dateAiro Health ,http://www.airohealth.com/,s2016,We have built the world's first automatic calorie-intake tracker.AmberBox ,http://amberbox.com/,s2016,Detect Gunshots | Inform Law Enforcement | Empower First RespondersApolloShield ,http://www.apolloshield.com/,s2016,ApolloShield is a system that detects unwanted drones and drives them away.Aptonomy ,http://www.aptonomy.com/,s2016,"Aptonomy has developed intelligent security drones that serve as your flying security guards. They tirelessly patrol outside your property around the clock, and actively deter crime by establishing physical presence at the site."Athelas ,http://athelas.com/,s2016,Rapid blood diagnostics through deep learning.BulldozAIR ,https://www.bulldozair.com/,s2016,Project management platform for construction & maintenance teams.Burrow ,http://www.burrow.com/,s2016,Care Revolutions ,https://www.carerevolutions.com/,s2016,A Marketplace for Healthcare professionals to find shifts.CoinTent,,s2016,Recover revenue lost to ad blockersCoub ,http://coub.com/,s2016,"Coub is YouTube for video loops. You can take any video from YouTube, Facebook or upload your own. Trim it to the best part, mix it with other videos or add a soundtrack"CrowdAI ,https://crowdai.com/,s2016,"Infrstructure and other feature detection from satellite imagery. We use deep learning computer vision algorithms to detect infrastructure, such as roads, buildings, and other features, from satellite imagery."Curtsy ,http://curtsyapp.com/,s2016,Curtsy is an app that lets women rent dresses from each other.DevColor ,http://www.devcolor.org/,s2016,We give Black software engineers the support they need to enter and advance in the tech industry.Drivezy ,http://www.drivezy.com/,s2016,"Airbnb for cars in India. $120 k net revenue per month. $500 dollars average income per car / month Average income of an Indian is also 500 dollars. "" car is an earning member of your family """Elemeno Health ,http://elemenohealth.com/,s2016,"The first personal assistant for frontline healthcare teams. We get nurses, docs, and staff on the same page. Through just-in-time microlearning, we put best practices in their hands, and drive quality and consistency at the point of care."Emote ,http://www.emotenow.com/,s2016,Emote is a K-12 app that helps schools catch student behavior problems before they start.EventGeek ,http://www.eventgeek.com/,s2016,"EventGeek in event intelligence. We help companies drive higher event ROI through competitive intelligence, team productivity and sales enablement."Expo ,https://expo.io/,s2016,"Expo brings together the best of web (development speed, fast iteration cycles, easy deploys, and automatic cross-platform support) and the performance and user experience of native apps. Let's talk if you're planning to build a mobile app."ExVivo Labs ,http://www.exvivo.ca/,s2016,"ExVivo Labs is developing a non-invasive skin patch for allergy testing, making the process safe, simple and certain."Fabric ,http://www.fabric.me/,s2016,"echoworks is Arun Vijayvergiya and Nikolay Valtchanov, two former Facebook engineers. We make Fabric, an iOS app that automatically and privately catalogs your real-world experiences and interactions."Farmstead ,http://farmsteadapp.com/,s2016,An AI-powered digital grocer that delivers in under 60 mins.Fellow ,https://joinfellow.com/,s2016,API for Invoice FinancingFlutterwave ,https://flutterwave.com/,s2016,"One API for any kind of payment across Africa. We partner with banks help large companies like Uber accept Credit Card, ACH, mobile money and cash token payments from across Africa."GoGoGrandparent ,https://gogograndparent.com/,s2016,"GoGoGrandparent is an automated concierge for seniors and their families that allows them to order rides, meals and groceries from a flip phone or landline."GTRACK Technologies ,http://www.gtracktechnologies.com/,s2016,Nanoparticle tracers for reservoir characterization during hydraulic fracturing.Haywheel,,s2016,Haywheel is an artisan food marketplace for restaurants and specialty food stores.Hellobill ,http://hellobill.io/,s2016,"Hellobill aggregates all your business bills, automatically, every month."HiOperator ,http://www.hioperator.com/,s2016,"Customer support as a service. We augment your existing team. Plans are pay-as-you-go, scaling up or down as needed based on incoming volume. We are US based, charge on a per *solved* case basis, not per reply, and you only need to train us once."Hush ,http://www.shophush.com/,s2016,Hush is the top social commerce app in the United States.Innov8 ,http://www.innov8.work/,s2016,"We provide co-working offices to startups, freelancers and SMEs in India."Instrumentl ,https://www.instrumentl.com/,s2016,Instrumentl simplifies the grants process for researchers and nonprofits.Iris Automation ,http://www.irisonboard.com/,s2016,Collision avoidance system for industrial drones. Our mission is to enable the $23bn industrial drone revolution.Joy ,http://withjoy.com/,s2016,Joy is a tool that helps couples plan their wedding from engagement to honeymoon and everything in between.Jumpcut ,http://www.jumpcut.com/,s2016,Online courses that feel like movies.Legalist ,https://www.legalist.com/,s2016,Legalist provides algorithmic litigation financing for small businesses with meritorious lawsuits.Lendsnap ,http://lendsnap.com/,s2016,The Digital Mortgage Company. Lendsnap automatically gathers loan qualifying documents and data to take the pain out of lending. Lendsnap is the only account aggregator enhancing portfolio liquidity with original source documents.Livement ,https://boletomovil.com/,s2016,Livement is a mobile app that sells tickets and concessions for sports stadiumsLocoAI ,http://www.locoai.com/,s2016,"Small, low-cost LIDAR"Lollicam ,http://lollic.am/,s2016,"The easiest and funniest video creation app to create beautiful moments with your friends and family. It will connect all the contents from movie, animation, cartoon, game and any you love with your everyday life."Looklive ,https://www.looklive.com/,s2016,Looklive is a community and marketplace for fashion. Users browse the style of celebrities and shop their looks.Luminostics ,http://www.luminostics.com/,s2016,Smartphone adaptor for DIY disease testingMeesho ,http://www.meesho.com/,s2016,"Meesho is the simplest way for Indie sellers in India to setup, manage and grow their business on Facebook and WhatsApp."Mentat ,https://www.thementat.com/,s2016,Mentat helps young professionals get great jobs.MessageBird ,http://messagebird.com/,s2016,"MessageBird is an API for sending Text, Voice & Chat messages. We offer the most advanced messaging API, packed with features and customizable parameters for high-volume and demanding message senders."Metapacket,,s2016,Metapacket is the first selective web gateway that stops malware by blocking non-human communication in corporate networks.Mindori ,http://www.mindori.com/,s2016,Mindori builds white-label voice search for e-commerce apps.Miso ,http://www.getmiso.com/,s2016,Instantly book quality home cleanings in South Korea.Mosaix ,https://mosaix.ai/,s2016,Semantic search AI for voiceMultiply Labs ,http://multiplylabs.com/,s2016,"At Multiply Labs, we use 3D printers to manufacture polypills - customized pills that contain multiple medications and release them at the right time."NeoWize ,http://www.neowize.com/,s2016,NeoWize created a new type of machine learning algorithm and uses it to improve personalization algorithms in e-commerce sites.New Incentives ,http://www.newincentives.org/,s2016,Cash transfers that save lives.Nova Credit ,http://www.neednova.com/,s2016,API for global consumer finance informationNuCypher ,http://nucypher.com/,s2016,Proxy re-encryption for distributed systems.Oh My Green ,http://www.ohmygreen.com/,s2016,"We make employees healthy, happy, productive, and retain better through snacks, beverages, catering and more"OMG Digital ,http://omgdigitalinc.com/,s2016,Buzzfeed/Vox Media for AfricaOneChronos ,https://www.onechronos.com/,s2016,"A financial exchange that reduces costs, increases trading volume, and prevents information leakage via a revolutionary approach to matching buyers with sellers."OOHLALA Mobile ,http://oohlalamobile.com/,s2016,OOHLALA is building the mobile OS for higher education. We power over 150 institutions in 7 countries to improve student engagement and communication on campus.OpenAI ,https://openai.com/,s2016,Opsolutely ,https://www.opsolutely.com/,s2016,Automated deployments for software teams.Pando ,http://www.askpando.com/,s2016,Market network for home services. Hire great contractors recommended by friends and neighbors.PatientBank,,s2016,Get medical records online—from any doctor or hospital.People.ai ,https://people.ai/,s2016,AI for aligning sales & marketing in enterprise.Polymail ,https://polymail.io/,s2016,Email productivity platform for business.Prime Lightworks ,http://www.primelightworks.com/,s2016,"Prime Lightworks Inc. manufactures electric propulsion systems for space satellites. We engineer new possibilities in space while drastically reducing cost and waste, by replacing propellant systems with radio frequency resonant cavity thrusters."Proxy ,https://proxy.co/,s2016,We are on a mission to equip every person on the planet with a universal signal that augments them in the physical world.Quero Education ,http://quero.education/,s2016,"Quero is an online marketplace for college programs in Brazil. It helps students search, compare and enroll in programs in over 1200 partner colleges, saving money on tuition."Raptor Maps ,http://www.raptormaps.com/,s2016,Raptor Maps helps farmers A/B test their produce by using drones and machine vision.Reebeez ,http://reebeez.com/,s2016,"Reebeez creates powerful microengines for UAVs. With a 2hr + flight time, our microengine has a specific energy 8x better than batteries at a third of the cost. Reebeez expands the possibilities and applications of UAVs!"Revlo ,http://www.revlo.co/,s2016,Revlo helps broadcasters on Twitch engage and monetize their fan base. We do this by allowing broadcasters to create interaction opportunities for their fans at scale.RigPlenish ,http://rigplenish.com/,s2016,"On average each Ambulance run is two hours long, 40 minutes is spent on doing paperwork. Our vision is to reduce those 40 minutes to 4 minutes."Robby Technologies ,http://robby.io/,s2016,"We are building a fleet of autonomous mobile robots that travel on sidewalks and deliver things to your doorstep, at low cost and high efficiency."RocketLit ,http://www.rocketlit.com/,s2016,"RocketLit is an adaptive learning and assessment platform. We write articles at 7 different reading levels, serve them to every student in a classroom at their independent reading level, and fluidly adapt the level students receive as they improve."Rose Rocket ,http://roserocket.com/,s2016,Rose Rocket is ERP software for trucking companies.RunKit ,https://tonicdev.com/,s2016,Sage Care,,s2016,Get care at home for mom or dad from trusted professionals in their neighborhood. Manage visits through text and email.Saleswhale ,http://saleswhale.io/,s2016,"Saleswhale is an automated sales assistant that follows up with your stale and cold leads, engaging them in two-way conversation - before handing off hot leads to your sales team."Scale ,http://www.scaleapi.com/,s2016,Scale is an API for ground truth data.Selfycart ,https://www.selfycart.com/,s2016,Selfycart - let's grocery shoppers scan items and checkout on their phone without waiting in checkout line.Seneca Systems ,https://www.senecagov.com/,s2016,Constituent system-of-record and service request management software for local government.Shield Diagnostics ,http://shielddx.com/,s2016,Fighting antibiotic resistance with genomics.Simbi ,http://www.simbi.com/,s2016,Simbi is a marketplace to barter services.SimpleCitizen ,http://www.simplecitizen.com/,s2016,"From signup to citizenship, only SimpleCitizen guides applicants through the entire immigration process, providing a truly comprehensive solution that's fast, accurate, and affordable."SkyLights ,http://www.skylights.aero/,s2016,VR on planes as inflight entertainmentSmartPath ,http://smartpathfinancial.com/,s2016,Financial education and budgeting for hourly and blue collar employees.SmartSite,,s2016,"Smartsite is a hardware device to protect workers from health risks on the construction site. It is a connected sensor unit that detects noise, fine airborne particles and UV. We make construction safer and save companies money."Squire Technologies ,http://getsquire.com/,s2016,OpenTable for barbershopsStarcity ,https://starcity.com/,s2016,"Starcity builds a new real estate product between hotel and housing, known as coliving. Our mission is to make great cities accessible to everyone."Starsky Robotics ,http://starskyrobotics.com/,s2016,"Driverless Trucks, for real."Suiteness ,https://www.suiteness.com/,s2016,Get exclusive access to the best suites at luxury hotels.Sway Finance,,s2016,Sway is bringing AI to the accounting industryTechmate ,https://www.techmate.com/,s2016,A technology concierge for your home. We provide on-demand support for all your internet-connected devices.The Athletic ,https://theathletic.com/,s2016,Subscription sports media.The Flex Company ,http://www.flexfits.com/,s2016,FLEX is a new product that replaces tampons.Upgraded ,http://upgraded.io/,s2016,Upgraded helps retailers and carriers sell devices Upgrade Plans.Validere ,http://validere.com/,s2016,Validere makes a handheld device that provides instant testing of liquid products to large industries. Validere brings lab testing to the field by replacing the need for trained technicians to conduct analytical testing.Vetcove ,https://www.vetcove.com/,s2016,"Vetcove is Kayak for veterinary hospitals. We're a B2B marketplace for the animal health supply chain. Clinics can compare prices and what's in stock among vendors, and buy their pharmaceuticals, biologics, equipment, and supplies from one website."Vidcode ,http://vidcode.com/,s2016,"Vidcode teaches teenagers computer science through their favorite video technologies: instagram, snapchat and virtual reality."Vote.org ,http://www.vote.org/,s2016,"Vote.org uses modern technology to radically increase voter turnout. We're raising $775k to run the most innovative, cost-effective voter registration drive in history. If you love technology and democracy, we're your group."Wallarm ,https://wallarm.com/,s2016,Application and API security for the modern webWhyd ,https://whyd.com/,s2016,"We make a beautiful, great sounding, voice-controlled speaker."Women Who Code ,https://www.womenwhocode.com/,s2016,WWCode is a non profit with a set of programs that helps mid-career engineers get promoted.WorkRamp ,https://www.workramp.com/,s2016,"WorkRamp builds training and knowledge management software for the modern workforce for companies like McAfee, Intercom, and PayPal. We provide enablement software to help companies build end-to-end training programs."Xberts ,https://www.xberts.com/,s2016,Xberts.com is a cross-border marketplace for Chinese hardware products.YesGraph ,http://yesgraph.com/,s2016,"YesGraph recommends exactly who a user should invite to an app. Our API can help boost the performance of sharing, referral, and invite flows. If you have a social application or a referral program, we should talk!"Yoshi ,https://www.startyoshi.com/,s2016,Gas delivered to your car so you never have to go to the gas station again.Able Health ,http://ablehealth.com/,w2016,Able Health gets doctors paid more for higher quality careAcre Designs ,https://www.acre.co/,w2016,"Acre creates homes that are built for life. We build future ready home that are sustainable, affordable, and inspired."Airmada,,w2016,Autonomous ground stations for dronesAlphaFlow ,http://www.alphaflow.com/,w2016,AlphaFlow makes investing in real estate as easy as adding stocks to your portfolio. 100% passive with unparalleled diversification. “You make 1 investment. We build you a diversified real estate portfolio. It's that simple.”Anchor Health ,http://anchorhealth.com/,w2016,"Modernizing home health care agencies with software, hardware, and operating systems"Astranis ,http://www.astranis.com/,w2016,"We're building small, low-cost telecommunications satellites to help bring online the 4 billion people who are without internet access."Bonsai ,https://www.hellobonsai.com/,w2016,All-in-one freelancing solution for the world's best creative freelancers.Boom ,http://boom.aero/,w2016,Mainstream supersonic passenger airplanesBus.com ,http://www.bus.com/,w2016,The easiest way to charter a bus in North America.Caper ,http://queuehop.com/,w2016,"QueueHop is an anti-theft apparel security tag. Once a payment is made via mobile, shoppers can unlock the security tag and skip the checkout line."CareSkore ,http://www.careskore.com/,w2016,"Please call Puneet Grewal at 312-860-0770 for any urgent issues. She has operating control as I am on a health-related leave. CareSkore is Default Alive, but I am burnt out."Castle,,w2016,Castle manages rental homes for landlords using automation and on-demand labor.Castle Intelligence ,https://castle.io/,w2016,Castle analyzes user behavior to stop hackersChatfuel ,http://chatfuel.com/,w2016,Platform to easily create chatbots to engage with audiences on messengers.Chillabit ,http://justchillabit.com/,w2016,"Chillabit is the best way to procrastinate! It’s a live feed of funny and relatable student stories that capture student life. From inside jokes to heart-felt stories, it is a place for sharing your thoughts and connecting around shared experiences."Compgun,,w2016,Sales commission software that grows revenue.ConstructVR,,w2016,"The simplest way to test, manage, and deploy VR/AR apps at scale."Copia ,http://www.gocopia.com/,w2016,"Copia's a for-profit technology company that solves food waste & hunger at scale. Our technology-driven service helps businesses reduce disposal costs, save huge on taxes, give back to the community while solving the world's dumbest problem: hunger."Cover ,http://cover.com/,w2016,Daily ,https://pluot.co/,w2016,"Big-screen video conferencing that's inexpensive, easy to set up, and easy to use."Deako ,https://www.deako.com/,w2016,"We make beautiful connected light switches that allow you to control any light in your home from any switch or your mobile phone, and we are at least 1/10th the cost of any comparable system."Deepgram ,https://www.deepgram.com/,w2016,Speech search engine and recorded call analytics for business.DoseDr,,w2016,"Helping diabetes patients use the correct amount of insulin, preventing the $150 billion in annual costs from diabetes complications and hospitalizations."Drive Motors ,http://drivemotors.com/,w2016,Online checkout for car dealerships.Elucify,,w2016,Elucify is a free and crowdsourced database of business contact information. Want free leads? Let us know!Embark Trucks ,http://embarktrucks.com/,w2016,Embark is building self-driving trucksEmburse ,https://www.emburse.com/,w2016,"Emburse allows businesses to issue virtual or physical debit cards to employees or contractors, set spending controls on each card, and simplify bookkeeping via automatic transaction categorization."Enflux ,http://getenflux.com/,w2016,Motion capture clothing for injury preventionEnvyl ,http://www.envyl.com/,w2016,"Envyl enables a fast, reliable and cost effective peer to peer delivery for overseas shoppers."FightCamp ,http://joinfightcamp.com/,w2016,At-home Fitness Boxing workout videos with motion sensors on your wrist and a live leaderboard. Think Peloton for Fitness Boxing.flexReceipts ,http://www.flexreceipts.com/,w2016,"Smart digital receipts for physical stores to help retailers engage customers and increase sales; all while creating the ability to track offline customers and their purchases across retailers (i.e., offline cookie for the real world)."FlowCommand ,http://flowcommand.com/,w2016,FlowCommand is a water management solution for oil and gas operators.Focal Systems ,http://www.focal.systems/,w2016,Function of Beauty ,http://www.functionofbeauty.com/,w2016,"Founded with the mission to revolutionize the beauty industry with customized formulations of shampoo and conditioners tailored to individual hair goals and needs, Function of Beauty celebrates individuality through technology."Gecko Robotics ,https://www.geckorobotics.com/,w2016,We develop robots for industrial inspections.Georgette Packaging ,http://www.georgettepackaging.com/,w2016,Georgette Packaging powers the relationship between small businesses and packaging manufacturers.GetAccept ,https://www.getaccept.com/,w2016,"Track, engage & eSign all your sales and business documents with GetAccept."Gigwell ,http://gigwell.com/,w2016,"Gigwell streamlines the booking process between live entertainers and venues (Musicians, Comedians and Public Speakers). Our platform makes it easy to send contracts, build tour itineraries and collect online payments."GitPrime ,https://gitprime.com/,w2016,Productivity analytics for software teamsGoLorry ,http://www.golorry.com/,w2016,Mobile marketplace for long-distance trucking in IndiaGoodybag ,http://goodybag.com/,w2016,An online tool for companies to order food from restaurants and caterers.Halolife,,w2016,"Halolife is an online platform to find and plan a burial or cremation service that meets your needs, budget, and location."Hingeto ,https://www.hingeto.com/,w2016,A B2B marketplace that connects inventory to online storesHistoWiz ,http://histowiz.com/,w2016,Accelerating Histopathology for Cancer ResearchIndex ,http://www.index.io/,w2016,Mapping the world's professional relationships.InnoVein ,http://innoveinmedical.com/,w2016,We cure intractable leg wounds with a prosthetic valve for veins.Instabug ,https://instabug.com/,w2016,"In-app feedback and bug reporting for mobile apps. We're helping apps squash bugs in their beta apps and engage users in their production apps. If you're building a mobile app, we'd love to talk."Interstate Analytics,,w2016,"Interstate is a marketing analytics platform that makes it easy to automatically track return on ad spend across multiple channels and devices so you can spend less time in Excel, SQL, and ad reporting interfaces, and more time on optimizing spend."Iron Ox ,http://www.ironox.com/,w2016,"Robotic greenhouses for cheaper, sustainable farming."iSono Health ,http://www.isonohealth.com/,w2016,At-home ultrasound imaging platform for early breast cancer detectionKip Health ,http://kiphealth.com/,w2016,Therapy the way it should be: high quality in-person therapy sessions paired with digital support.Kisan Network ,http://www.kisannetwork.com/,w2016,Online trading platform for Indian agricultureKonsus ,http://konsus.com/,w2016,The Fastest Online Outsourcing SolutionLanded ,http://www.landed.com/,w2016,Landed makes buying a home more affordable and less risky by investing alongside you when you make a down payment. We enable community investment that helps teachers and school staff become homeowners.