profolio,website,year,summaryXfers ,http://xfers.io/,s2015,Xfers makes it possible for people to make and receive payments via Bank transfers via API. We built a proprietary system to allow us to integrate with any banks in a week. Drop us a note if you are interested in Indonesia and SingaporeZeplin ,https://zeplin.io/,s2015,Zeplin is the best way for UI designers & frontend developers to work together. We take design files and generate resources that developers need.zPREDICTA ,http://zpredicta.com/,s2015,"zPREDICTA (formerly Ixchel Scientific) is creating cell-based biological models that predict how drugs will behave in the human body, eliminating the guesswork from drug development."20n,,w2015,Using AI to predict biochemistry for manufacturing and therapeutics3dot,,w2015,Akido Labs ,http://akidolabs.com/,w2015,"Akido Labs is a data technology company leading the transformation of healthcare and government institutions into modern, data-driven organizations. By building and connecting human services data networks, we'll create the equitable world we envision"Atomwise ,http://atomwise.com/,w2015,Artificial intelligence for drug discovery.Automate Ads,,w2015,"On a mission to programmatically automate, optimize, and unify your digital advertising campaigns with incredible software."Bagaveev Corporation ,http://bagaveev.com/,w2015,Launch small satellitesBankjoy ,http://bankjoy.com/,w2015,White-label credit union softwareBluesmart ,http://bluesmart.com/,w2015,Bluesmart makes smart luggage powered by an app to empower people to travel.Bonfire ,http://gobonfire.com/,w2015,"Reimagining sourcing: Bonfire is the leading next-generation competitive bidding and RFx platform, empowering modern procurement teams to make faster, more strategic decisions."Booktrope,,w2015,Booktrope provides a software platform that makes it easy for creative teams to turn manuscripts into polished books and market them – at scale.Bright ,http://thinkbright.co/,w2015,SolarCity for developing worldBuildScience ,http://www.buildscience.com/,w2015,"The operating system for commercial buildings. With little to no additional hardware, we make buildings smarter by connecting to HVAC, lighting, metering, security and more."Cboe Vest ,http://www.cboevest.com/,w2015,Bringing wider access to financial derivatives.Chariot ,http://chariot.com/,w2015,"The world's first private mass transit service providing a commuting experience that's faster, more reliable and more comfortable than public transit, while more affordable than ridesharing and driving. #commutesolved"Cheddar,,w2015,The Best Mobile Checking AccountCinder ,http://cindercooks.com/,w2015,"The World’s First Countertop Precision Grill – using two ceramic heating plates to cook your meal to a precise target temperature, Cinder allows you to create amazing meals every day."Cleanly ,https://cleanly.com/,w2015,Laundry & Dry Cleaning delivered.ClearMind Biomedical ,http://clearmindbiomedical.com/,w2015,Medical devices that save lives and improve recovery for patients with brain hemorrhageColor Dating ,http://www.colordatingapp.com/,w2015,Actually pivoted to a dating app. Boom! http://www.colordatingapp.comCribspot,,w2015,Tech-Enabled Real Estate Company (YC W15)CyberFend ,http://cyberfend.com/,w2015,"Cyberfend delivers robust, real-time web and mobile security by preventing account take-over, synthetic sign-ups and monetary fraud. In addition, Cyberfend's BotFender is the most comprehensive bot/automation detection service available today."Dealyze ,http://dealyze.com/,w2015,We are building the customer and employee engagement platform for franchise organizations.Democracy Earth ,http://democracy.earth/,w2015,"Incorruptible digital governance for small communities, corporations, large cities & whole nations."DemocracyOS ,http://www.democracyos.org/,w2015,"Online space for deliberation, policy making and democratic participation. We bring institutions and citizens together."Diassess ,http://diassess.com/,w2015,Next Generation Disease TestingDirect Match,,w2015,DroneBase ,http://dronebase.com/,w2015,"At DroneBase, we provide fast, affordable, and reliable data from the air so our customers can make better-informed, real-time decisions about their most critical assets."eBrandvalue ,http://ebrandvalue.com/,w2015,"Real-time Nielsen ratings for Brands. Accelerate marketing and product through social. Inform customer interactions, find market opportunites, and spot industry trends faster—from science."EquipmentShare ,http://equipmentshare.com/,w2015,"EquipmentShare is a better way to rent equipment. Offering the newest fleet, 24/7 on-demand service and built-in telematics."Final ,http://getfinal.com/,w2015,A credit card that drastically reduces payment fraud and gives consumers total control over their merchant relationships.Flip ,http://justflip.com/,w2015,"""eBay for the Snapchat generation"" Fastest, guaranteed resale on specialty items."GitLab ,http://gitlab.com/,w2015,"Git repository management, code reviews, issue tracking, issue boards, activity feeds, wikis and continuous integration. Community driven with more than 1000 contributors."Giveffect ,http://giveffect.com/,w2015,"Fundraising, Volunteer and Donor Management SaaS for nonprofits."GiveMeTap ,http://givemetap.com/,w2015,We produce & sell stainless steel water bottles that enables people to get free water refills from our partner shops which they can locate via our GiveMeTap App. For each bottle sold we’re able to give a person in Africa access to clean water.Glassjar,,w2015,Clean app for check writingGroupAhead ,http://groupahead.com/,w2015,Improve communications with your group's own mobile app.GrubMarket ,http://grubmarket.com/,w2015,"GrubMarket is today's fastest-growing online farmers' market supplying fresh healthy local food directly from local farms and food producers, to local people, community and local companies, with affordable prices and convenient delivery."HigherMe ,http://higherme.com/,w2015,"HigherMe helps retail and hourly employers find, screen, and hire better employees faster."Industrial Microbes ,http://imicrobes.com/,w2015,We upgrade methane to chemicals using synthetic biology.InsiteVR ,http://insitevr.com/,w2015,Virtual Reality software for architecture and new construction. InsiteVR automates the process of going from 3D to VR and offers comprehensive VR presentation tools to help companies use VR to communicate new spaces and ideas to their clients.Instavest ,http://goinstavest.com/,w2015,Kickback ,http://kickback.com/,w2015,Gambling in Video Games.Kickpay ,https://kickpay.com/,w2015,"A marketplace for buying and selling invoices. Businesses improve their cash flow and don't have to wait 60 days to get paid, while investors get access to a whole new asset class which is extremely liquid, low risk, and has double digit returns."Labdoor ,http://labdoor.com/,w2015,Labdoor is building the trusted online drugstore.Leadable ,http://leadable.com/,w2015,Real Estate LeadsLevel ,http://levelframes.com/,w2015,Software eats custom framingLogDNA ,https://logdna.com/,w2015,Easy beautiful logging in the cloud.Lully ,http://lullysleep.com/,w2015,"Lully is developing an under-the-mattress technology that precisely controls sleep stages. We use this to avoid problems in sleep, such as bedwetting, snoring, and night terrors, by getting users into safer stages of sleep prior to the event."Lumi ,http://lumi.com/,w2015,"Lumi is the packaging partner for online brands. Companies such as MeUndies, Threadless, Primary and thousands of others rely on Lumi to supply a wide array of boxes, mailers, tape and paper products through our intuitive web app."Magic ,https://getmagic.com/,w2015,Upgrade your life with a 24/7 personal assistantMashgin ,http://mashgin.com/,w2015,Self-Checkout using Computer Vision.Meadow ,https://getmeadow.com/dispensary-software,w2015,Point of Sale and Compliance SaaS for Cannabis DispensariesMetricWire ,http://metricwire.com/,w2015,Mobile surveys for researchersMoltin ,https://moltin.com/,w2015,"eCommerce building blocks through simple APIs for websites & apps. APIs include inventory, cart, checkout, payments and more."Nextop,,w2015,"Nextop optimizes the path between your app and backend. Client libraries + proxy server. Improves speed, reliability, and battery usage with no change to your backend."NexTravel ,https://www.nextravel.com/,w2015,NexTravel is a centralized travel booking platform that helps companies save time and money.NimbleRx ,http://nimblerx.com/,w2015,Full Service PharmacyNomiku ,http://nomiku.com/,w2015,We make sous vide machines that allow anyone to cook restaurant quality dishes in their own home.Notable Labs ,http://notablelabs.com/,w2015,Personalized drug combination testing service for blood cancersOmniref,,w2015,"Sticky notes for code. (We're building a community-powered, code-based reference for programmers.)"Open Listings ,https://www.openlistings.com/,w2015,A better way to buy a homeOutbound ,http://outbound.io/,w2015,"Create automated messages -- email, iOS/Android push, SMS and web notifications -- that we send in real-time as users take actions inside your product, then measure the effect of each message on user behavior."Pachyderm ,http://pachyderm.io/,w2015,Pachyderm is “Git for Data Science.” We offer complete version control for data and give your data science team the same first-class development tools as software developers.Pakible ,https://pakible.com/,w2015,"We make it insanely easy to design, price, and manufacture custom product packaging. Pakible is an unbeatable experience and price compared to brokers or direct manufacturers."Paperspace ,https://paperspace.com/,w2015,"Cloud computing made simple. Paperspace is a GPU accelerated cloud platform for individuals, startups, and the enterprise."Pigeonly ,http://pigeon.ly/,w2015,"Our unique platform makes it possible for people to easily search, find and communicate with their inmate using our consumer facing products."Platzi ,http://platzi.com/,w2015,"Live streaming classes on design, marketing and code. Learn from industry leaders."Pomello ,http://pomello.com/,w2015,"Analytics software that helps companies measure organizational culture, screen talent for ""fit"", and drive high performance cultures."Popular Pays ,http://popularpays.com/,w2015,"Popular Pays is the largest, most active, and most reliable marketplace where social media creators and brands meet to create content worth sharing."Pretty Instant ,https://www.prettyinstant.com/,w2015,"Hand selected photographers for all occasions, nationwide. #NoSelfies We also build proprietary photo-marketing technology used by household brands & innovative startups across the country."Priime ,http://priime.com/,w2015,"Priime is a company dedicated to advancements in technology around visual creative content like photography. We work heavily in native desktop, mobile, and web applications, as well as R&D in the blockchain space with the PRM platform."Qventus ,http://qventus.com/,w2015,We help hospitals run efficiently by predicting department resource needs and providing front line staff with real-time resource allocation guidance.Rare Door,,w2015,Empowering brick-and-mortar retailers to sell more and engage shoppersRaven Tech ,http://raventech.com/,w2015,"Our vision is to build the next generation of iOS or Android, to fundamentally change how we interact with our mobile devices. We start from Flow 1.0, you use voice to access hundreds of apps' data and services from the cloud in real time."Razorpay ,https://razorpay.com/,w2015,A modern online payment gateway for IndiaReadMe ,http://readme.io/,w2015,"ReadMe provides every company the ability to quickly and easily create beautiful documentation, and build loyal and productive developer communities."Remix ,https://www.remix.com/,w2015,Software for transit / public transportation planningReplika ,https://replika.ai/,w2015,Replika is an AI friend that you grow by talking to it.ReSchedule Med,,w2015,"We help medical residency programs create and manage their schedules, by providing end to end scheduling workflows."Rescue Forensics,,w2015,Actionable human trafficking intelligenceShasqi ,http://www.ycombinator.com/companies/shasqi.com,w2015,Implantable hydrogel increases drug effectivenessShift Labs ,http://shiftlabs.com/,w2015,"Makers of simple, affordable medical devices for low resource healthcare settings. Our award-winning DripAssist Infusion Rate Monitor provides safe, continuous monitoring for gravity IV infusions to ensure proper medication dosage in any environment."Shift Messenger,,w2015,Real-time communication solution for retail and restaurant employees.SigOpt ,https://sigopt.com/,w2015,SigOpt is an Optimization-as-a-Service platform that seamlessly tunes AI and machine learning models with state-of-the-art Bayesian optimization techniques behind a simple APISIRUM ,http://sirum.org/,w2015,SIRUM is a “match.com” for unused medicine. We connect institutional surplus medicine with safety-net clinics.Smarking ,http://smarking.com/,w2015,Enable hassle free parking and highly efficient urban mobility by digitizing parking supply and distributing inventory dynamically worldwide.SmartSpot ,http://smartspot.io/,w2015,Retrofitting gyms with personal training hardwareSmyte ,http://smyte.com/,w2015,Smyte stops bad actors on social networks and marketplaces.Spark Gift,,w2015,SparkGift makes it easy to send stocks and index funds as gifts to friends and family.Spire ,http://spire.io/,w2015,Realtime mindfulness and chronic disease sensor platformSpoil,,w2015,Spoil is gifting for the Snapchat generation.Standard Cyborg ,http://standardcyborg.com/,w2015,The API for the Physical WorldTab ,https://www.tab.travel/,w2015,Booking and payment platform for travellers abroad – cheaper and safer for travellers & tourist businesses.TARA ,http://www.tara.ai/,w2015,"AI project manager, leading software development."TeamNote ,http://teamnoteapp.com/,w2015,Mobile Productivity (Slack for mobile workforces)Tech in Asia ,http://techinasia.com/,w2015,"Tech in Asia is a media, events, and jobs platform for Asia’s tech communities."The Human Utility ,http://humanutility.org/,w2015,The Human Utility seeks to eliminate water service disconnections for low-income and elderly people using crowds and data.themidgame ,http://themidgame.com/,w2015,Promote brands through social media influencersThinAir,,w2015,Intelligent data security for teamsTrackin ,http://trackin.co/,w2015,"Software for real-time intra-city delivery. From online ordering, to real-time tracking, to customer follow-up, we've got you covered. We're also behind the first on-demand catering marketplace called MobyDish : http://www.mobydish.com"Transcriptic ,http://transcriptic.com/,w2015,The robotic cloud laboratory for the life sciences.Treeline ,http://treeline.io/,w2015,"The Sails Company was founded by the original author and maintainers of the Sails framework. In addition to free and open-source software, The Sails Company offers a full-service web & mobile studio and professional support for the tools we maintain."Underground Cellar ,http://undergroundcellar.com/,w2015,Wine deals without bastardizing brands.UserGems ,https://www.usergems.com/,w2015,Identify and Engage Influencers among your UsersValor Water Analytics ,http://valorwater.com/,w2015,Valor Water Analytics delivers a SaaS platform to utilities to detect and address water loss.Vanhawks,,w2015,"We are making the smart carbon fibre commuting bike and platform for smart bikes. Valour, our first product has turn-by-turn direction, blind spot detection system, anti-theft and best route suggestions through data to take you from point a to b."Vertical ,http://vertical.ai/,w2015,A.I. Software for augmented reality experiencesVetPronto,,w2015,On demand veterinary house calls.WayUp ,http://wayup.com/,w2015,Marketplace for college students and recent graduates to find and apply for jobs and internships.Wink Health ,http://winkhealth.com/,w2015,The digital sleep clinicWorkLife ,http://worklife.com/,w2015,WorkLife is a SaaS application that helps teams have more effective meetings.Yhat ,https://www.yhat.com/,w2015,End-to-end data science lifecycle management platform.Zenflow ,http://zenflow.com/,w2015,"Medical device that provides a more effective, less invasive treatment for BPH (enlarged prostate), which affects almost all men at some point in life"Alchemy ,http://www.alchemynano.com/,s2014,"Thin, transparent films for automobile windshields to prevent stone chips, block solar infrared heat, and prevent frost."Aptible ,http://aptible.com/,s2014,HIPAA platform as a serviceBackpack ,http://backpackbang.com/,s2014,Marketplace to get stuff from overseasBannerman ,http://bannerman.com/,s2014,Providing Security Guards for Every BusinessBayes Impact ,http://bayesimpact.org/,s2014,Nonprofit that brings data science solutions to big social problemsBeep,,s2014,Cellular networks for IoT.Bikanta ,http://bikanta.com/,s2014,Nano-diamonds for cancer detectionBillforward ,http://billforward.net/,s2014,"Subscription billing, rate plan management and analytics as a service. We help you optimise your product rate plans, if you have a subscription based offering we can help!"Bitaccess ,http://bitaccess.ca/,s2014,We make bitcoin simple.Blockspring ,http://blockspring.com/,s2014,Blockspring automates data collection by connecting your favorite tools to APIs.Blockstack ,http://blockstack.org/,s2014,Blockstack is a new internet for decentralized apps where you own your data and your apps run locally without remote servers.Carlypso ,http://carlypso.com/,s2014,Used car marketplaceCheckr ,http://www.checkr.com/,s2014,Checkr’s mission is to build a fairer future by improving the understanding of the past. We're modernizing how background checks are done.Clara Labs ,http://claralabs.com/,s2014,Clara schedules interviews for recruiting teams by combining the intelligence of software and the expertise of a team.ClearTax ,http://cleartax.in/,s2014,Intuit of India.Cognito ,https://cognitohq.com/,s2014,"Frictionless, modern identity verification that starts with just a phone number."Craft Coffee ,https://www.craftcoffee.com/,s2014,Better coffee for less moneyDoblet,,s2014,"Doblet solves the phone battery problem. We're building the first truly mobile power network, with patent-pending Apple-approved smart battery tech. Pick up and drop off anywhere -- now in 1000+ restaurants, bars, cafes, gyms and offices around SF!"Fixed,,s2014,iPhone app to fight your parking tickets.Flaviar ,http://flaviar.com/,s2014,Try-at-home service for fine spiritsFlynn ,https://flynn.io/,s2014,Flynn is an open source Platform as a Service (PaaS)Flytenow ,http://flytenow.com/,s2014,Ride sharing for small planesFront ,http://frontapp.com/,s2014,Collaborative Inbox for CompaniesGinkgo Bioworks ,http://ginkgobioworks.com/,s2014,The organism company.Greentoe ,http://greentoe.com/,s2014,"""Name Your Price"" for products"HauteDay ,http://hauteday.com/,s2014,Gaming Meets Women's Shopping.Helion ,http://helionenergy.com/,s2014,"Fusion, the future of energy."Hive ,http://hive.co/,s2014,"Hive is a customer data and email platform used by thousands of brands to personalize and automate their marketing campaigns. Our technology helps brands sell more stuff, while keeping their customers happy, engaged, and spending money."Hublo,,s2014,"Hublo is making data-driven marketing simpler. It's a super simple tool, allowing marketers to set-up analytics, monitor precisely what's happening on their website and launch remarketing campaigns without relying on their IT teams."Hyperpad ,http://www.hyperpad.com/,s2014,Hypercard for iPad. Allows non-technical people to create media rich interactive apps like mobile games then publish them to the App store as native apps with out writing a single line of code.Impraise ,http://impraise.com/,s2014,"Web & mobile platform for real-time performance check-ins, recognition & coaching"In Your Corner,,s2014,"We've transformed traditional therapy into an experience that is affordable, approachable & anonymous. Through video + written consultations, we connect clients with licensed therapists online so you can get the support you need when you need it."Kash ,http://withkash.com/,s2014,We are fixing how money works.Lawn Love ,https://lawnlove.com/,s2014,"Modern, on-demand lawn care service. Book a skilled, experienced lawn technician in under two minutes, and manage everything seamlessly from your phone or web browser."ListRunner ,http://listrunnerapp.com/,s2014,Replaces paper patient lists for doctors.MTailor ,http://mtailor.com/,s2014,Get measured by your phone in under 30 seconds for perfect fitting custom clothingNaytev ,http://naytev.com/,s2014,"Naytev optimizes the packaging and distribution of social content, saving teams time and driving more social conversions."Neptune.io,,s2014,A self-healing platform to enrich and fix server alerts automaticallyNightingale,,s2014,App for managing care of autistic studentsOklo ,http://oklo.com/,s2014,"Emission free, always on power."One Codex ,https://www.onecodex.com/,s2014,Genomic search and discovery.Owners Circle,,s2014,Kickstarter for local businessesPaid ,http://paidlabs.com/,s2014,Autopilot for Accounts ReceivableParenthoods,,s2014,Communities for expecting and new parents.Payable ,http://payable.com/,s2014,Simple payments and tax compliance for your contract workforce.Permutive ,http://permutive.com/,s2014,Platform for real-time personalizationPersistIQ ,http://www.persistiq.com/,s2014,"PersistIQ is the leading sales technology company that combines the human element of sales with intelligence and automation where it counts. In short, PersistIQ makes salespeople and organizations more effective than ever before."PicnicHealth ,http://picnichealth.com/,s2014,Your Medical Record ConciergeProduct Hunt ,http://producthunt.com/,s2014,Hacker News for ProductsProtocol Labs ,https://protocol.ai/,s2014,IPFS -- new hypermedia distribution protocol to replace HTTP (git + bittorrent) Filecoin -- cryptocurrency operated file storage networkQuora ,http://quora.com/,s2014,Q&A platformRavti ,http://ravti.com/,s2014,"Software to track, manage, and procure HVAC for commercial real estate."Replenish ,http://www.getreplenish.com/,s2014,Keurig machine for smoothies.Rigetti Computing ,http://rigetti.com/,s2014,Quantum coherent supercomputing.Roomstorm ,http://roomstorm.com/,s2014,Real time B2B hotel room marketplace for various industries specializing in hotel and airline guest reaccommodations.Roost ,http://goroost.com/,s2014,Web push notifications.SalesSift,,s2014,Intelligent Lead SourcingSFOX ,http://sfox.com/,s2014,Crypto-currency trading platform.Shift ,http://shiftpayments.com/,s2014,API platform for partners to issue branded debit and credit cards to their end users.ShipBob ,http://shipbob.com/,s2014,Providing Amazon level logistics to e-commerce businesses.Shout,,s2014,Real-Time ClassifiedsSliced Investing ,http://slicedinvesting.com/,s2014,Crowdfunding for hedge fundsSpotAngels ,http://www.spotangels.com/,s2014,Waze for parkingSpringWit,,s2014,Brain health and awarenessTAXA Biotechnologies,,s2014,"We enable cheaper, faster, and better genetic engineering of plants. We offer our platform both as a service and use it internally to develop our own engineered plants, eg fragrant moss. Currently raising money on www.wefunder.com/taxa"Tenjin ,https://www.tenjin.io/,s2014,Mobile marketing analytics and infrastructureThink Gaming ,http://thinkgaming.com/,s2014,"We provide market data on the mobile games business to developers, investors, and sales teams."Tinker,,s2014,Digital Currency Market MakingTule Technologies ,http://tuletechnologies.com/,s2014,On-farm sensors providing remote insights. The only company that can measure crop water use and crop stress over a broad area and prescribe an irrigation quantity for optimal results.uBiome ,http://ubiome.com/,s2014,Using Big Data and crowdscience to unlock the secrets of the human microbiomeUnwind Me,,s2014,Homejoy for massageVizeraLabs,,s2014,Fabric projector furniture salesWeave,,s2014,AI-assisted professional networking.Whirl,,s2014,Pay instantly with your fingerprint.Women.com ,http://women.com/,s2014,Quora/Cosmo for womenZen99,,s2014,Tax and insurance tools for independent contractorsZenamins ,http://zenamins.com/,s2014,Personalized health company doing customized vitamin packs on subscription and creating a platform for consumable health products.Zip Phone ,http://zipphone.com/,s2014,Whatsapp for voiceZoomer,,s2014,"Outsourced, high volume food delivery."42 ,http://42technologies.com/,w2014,Analytics for retailersAbacus ,http://abacus.com/,w2014,"Making expense reports obsolete. Abacus is the easiest way for you to reimburse your team, reconcile corporate credit cards, and implement your expense policy. Sign up for a free trial."AirHelp ,http://airhelp.com/,w2014,"AirHelp helps air passengers get compensation for delayed, cancelled and overbooked flights. Proud to be hated by the world's leading airlines!"AirPair,,w2014,Instant access to the world's best software experts via video chat and screen sharing.Algolia ,http://algolia.com/,w2014,"With 50 data centers in 15 regions, Algolia offers a developer-friendly and enterprise-grade search API. Designed to make every search interaction meaningful and rewarding, Algolia serves billions of queries weekly for more than 5,000 customers."