profolio,website,year,summaryAnnieCannons ,https://www.anniecannons.org/,s2018,A custom software development consultancy powered by survivors of human trafficking we have transformed into software engineers. We provide software-development-as-a-service on-demand.Dinesafe ,https://dinesafe.org/,s2018,We crowdsource food poisoning reports and help detect and prevent outbreaks.iLabService ,http://en.ilabservice.com/,s2018,"At iLabService, we are a subscription monitoring service for lab equipment. Our software and easy-to-install low-cost sensors make sure that each equipment is operating according to the specific spec required and alerts you when there are problems."Kobo360 ,http://www.kobo360.com/,s2018,"With Kobo's platform, companies now have easy access to a large pool of trucks with real-time tracking at affordable and flexible rates. Drivers conveniently find loads they want, are paid instantly and get reverse loads."Meru Health Inc. ,http://www.meruhealth.com/,s2018,"Meru Health is an online medical clinic for depression/burnout/anxiety treatment with remote licensed therapists, smart data-analytics to individualize treatment and a pay-only-for-outcomes business model."OpenPhone ,https://openphone.co/,s2018,Phone system for small businessesPapa ,http://www.joinpapa.com/,s2018,"Papa cures loneliness in senior citizens by connecting them to college students in their area for in-person companionship, social transportation, house help, teach technology, and more. The students are like ""Grandkids On-Demand."""Synvivia ,http://www.synvivia.com/,s2018,Synvivia develops engineered organisms that safely and effectively treat disease.Ubits ,http://ubits.mx/,s2018,Corporate online training for Latin AmericaAalo ,http://www.aalo.co/,w2018,Endlessly customizable furniture made easy and affordable.Abe ,https://www.hiabe.com/,w2018,Abe is the modern commercial insurance brokerage. We use technology to simplify the buying process for businesses and the selling process for brokers. Reach out if you have questions about buying insurance for your business!Aerones ,http://www.aerones.com/,w2018,Industrial Heavy lift drones for hi-pressure cleaning and firefighting.AesculaTech ,https://www.aesculatech.io/,w2018,AesculaTech is developing smart materials to enable next generation medical devicesAirship ,https://www.airshiphq.com/,w2018,AlgoSurg Inc ,http://www.algosurg.com/,w2018,We make software for surgeons to plan bone surgeries in 3D.Anjuna ,https://www.anjuna.io/,w2018,"Anjuna creates a software perimeter around applications that provides hardware-grade security for the application, which completely removes the need to secure or patch the host or the VM."ArchForm ,http://archform.co/,w2018,Replacing orthodontic braces with our clear aligner and softwareArrow ,https://arrowapp.io/,w2018,"Instagram for Augmented reality. Users can attach texts & emojis to people or objects, and share videos of it."Aspire ,https://www.aspire-cap.com/,w2018,Reinventing Banking for Small Businesses in SEAAtrium ,http://www.atrium.co/,w2018,Modern law firm for startups powered by proprietary technologyAvro Life Science ,http://avrolifesci.com/,w2018,Skin patches for generic drug delivery.Beanstalk ,http://beanstalk.farm/,w2018,"We grow heirloom food in automated, indoor farms."Bear Flag Robotics ,http://bearflagrobotics.com/,w2018,Ben ,https://ben.co/,w2018,"The easiest way to learn about, buy, and store cryptocurrency."Biobot Analytics ,http://biobot.io/,w2018,We analyze city sewage to estimate opioid consumption.BioRender.io ,https://www.biorender.io/,w2018,The Adobe Creative Suite for Life SciencesBloomJoy ,https://bloomjoy.com/,w2018,Associated Press for lifestyle content.Blueberry Medical ,https://blueberrymedical.com/,w2018,Unlimited pediatrician visits available 24/7 for peace of mind and avoiding unnecessary ER or doctor visits.BUMP ,https://sobump.com/,w2018,BUMP is a peer-to-peer streetwear marketplaceCalifornia Dreamin' ,https://www.drinkdreamin.com/,w2018,Cannabis infused beveragesCallisto ,https://www.projectcallisto.org/,w2018,We create tech to combat sexual assault and harassment.CaptivateIQ ,https://www.captivateiq.com/,w2018,CaptivateIQ makes it easy to pay your sales teams' commissions.ClearBrain ,https://clearbrain.com/,w2018,"Predict user conversion & churn, without a line of code."CodeStream ,http://codestream.com/,w2018,The knowledge base behind your codebase.Cognition IP ,https://www.cognitionip.com/,w2018,First tech-enabled patent law firm.CoinTracker ,https://www.cointracker.io/,w2018,Portfolio & tax manager for cryptocurrencyCorrelia Biosystems ,http://www.correliabio.com/,w2018,Next generation blood testing to provide 1000x more data to pharma companiesCulture Robotics ,https://culturerobotics.com/,w2018,We run automated bioreactors as a service.Curious Fictions ,http://curiousfictions.com/,w2018,Patreon for professional authors.Cursor Suite ,https://www.cursorsuite.com/,w2018,Dana Cita ,http://www.danacita.com/,w2018,"Financial services for the unbanked in Indonesia, starting with student loans."DearBrightly ,https://www.dearbrightly.com/,w2018,"DearBrightly makes personalized prescription skincare products, accessible to everyone."DeepMed ,https://deepmed.ai/,w2018,Delphia ,http://delphia.com/,w2018,Delphia builds artificially-intelligent surveys that help people make important decisions.Draftbit ,https://draftbit.com/,w2018,"Draftbit is a new way to build cross-platform, native iOS and Android apps in minutes instead of months."EasyEmail ,https://easyemail.ai/,w2018,Gmail app that helps you write emails quickly. We train our software with your inbox and quickly suggest what you should write based on your previous responses.Edwin ,https://edwin.ai/,w2018,"Edwin is an AI-powered English learning service delivered by chatbots, voice assistants, and humans. It prepares students for standardized tests, such as TOEFL and TOEIC. Edwin provides better outcomes in ⅓ the time at ⅓ the cost of existing methods."EnvKey ,https://www.envkey.com/,w2018,1Password for API keysEvry Health ,http://evryhealth.com/,w2018,"Better health insurance for companies with 200-1,000 employees that costs up to 20% less."Flint ,https://www.flint.mx/,w2018,"Pay friends and merchants in Mexico through your phone, even without a bank account."Gainful ,https://gogainful.com/,w2018,"Personalized protein powder, delivered directly to your doorstep."Glimpse K12 ,http://www.glimpsek12.com/,w2018,Glimpse eliminates ineffective spending in schools.Groww ,https://groww.in/,w2018,Simple investing for everyone in IndiaHaiku ,https://haiku.ai/,w2018,App builder that unifies design and codeHelloVerify ,https://www.helloverify.com/,w2018,Helloverify is an online background screening platform (Checkr for India).Hexel ,https://www.onhexel.com/,w2018,Create a cryptocurrency for your community.Hippo ,https://www.hippotech.co/,w2018,Hippo created an augmented reality markup language - ARML - which allows developers to create content for AR apps as easily as they use HTML on the webHopper ,http://hopper.ai/,w2018,Hunter2 ,https://hunter2.com/,w2018,Hunter2 trains engineering teams in application security through interactive online labs. Developers get hands-on practice exploiting and patching real web apps written in their tech stack.Iambiq Technologies,,w2018,Jido Maps ,http://www.jidomaps.com/,w2018,A lightweight API for persistent augmented reality.Juni Learning ,https://junilearning.com/,w2018,The best online education program for kidsKey Values ,https://www.keyvalues.com/,w2018,Helping software developers find teams that share their values.Lambda Tea ,http://lambdatea.com/,w2018,We build self-serve bubble tea dispensers! :DLawyaw ,http://www.lawyaw.com/,w2018,"Lawyaw automatically converts your internal businesses and legal documents into smart templates, saving you time, money, and the embarassement of careless errors."Leap ,https://leap.ycombinator.com/,w2018,Private network for women in techLetsDoThis.com ,https://www.letsdothis.com/,w2018,marketplace for endurance eventsLook After My Bills ,http://www.lookaftermybills.com/,w2018,"Personal fintech - we optimise your bills, every year, automatically."LUS Brands ,http://lusbrands.com/,w2018,Hair care products for curly hair.Macromoltek ,https://www.macromoltek.com/,w2018,Software for antibody modeling and analysisMedumo ,https://www.medumo.com/,w2018,We manage patient instructions for hospitalsMeitre ,http://meitre.com/,w2018,"Opentable for the world's top restaurants; we help them increase profit as much as 30% by optimizing table allocation, prioritizing high margin bookings at peak hours, and eliminating no-shows using tickets, deposits and credit card guarantees."Memora Health ,https://memorahealth.com/,w2018,A virtual nurse for patient follow-upMind Emulation Foundation ,https://mindemulation.org/,w2018,Mirror AI ,http://mirror-ai.com/,w2018,App that turns selfie photos into thousand emoji that look like you and your friends.Modern Health ,https://www.joinmodernhealth.com/,w2018,"Modern Health is a benefits platform that helps companies care for their employees' emotional well-being. From career path guidance to emotional health support, we help employees no matter what their goals are."Molly ,http://molly.com/,w2018,Molly answers questions about people using AINaborly ,https://naborly.com/,w2018,"AI powered credit scoring, underwriting, and insurance for the real estate industry."Necto ,http://joinnecto.com/,w2018,Internet Service Provider starter KitNectome ,https://nectome.com/,w2018,Preserve your brain to bring you back in the futureNewCraft ,https://www.newcraft.io/,w2018,"NewCraft onboards and trains engineers and designers, whether they are full-time or contract. We give new hires a set of tasks and guide them to completion using company tools and guidelines with audio and on-screen highlights."NEXGENT ,https://www.nexgent.com/,w2018,Nutrigene ,https://www.mynutrigene.com/,w2018,Personalized liquid supplements based your health dataobserve.ai ,https://observe.ai/,w2018,"Automating Quality Assurance(QA) process in Call Centers, leading to 60% reduction in QA cost and 8X increase in the monitoring coverage."onederful ,http://www.onederful.co/,w2018,API for dental insuranceOpenland ,https://openland.com/,w2018,Marketplace for urban landOpenSea ,https://opensea.io/,w2018,"OpenSea is the first and largest marketplace for digital collectibles, which include gaming items, digital art, and other virtual goods backed by a blockchain. On OpenSea, anyone can buy or sell these items using smart contracts."Orangewood Labs ,http://www.orangewood.co/,w2018,Orangewood Labs makes beautiful furniture quickly using robots.OSIMple ,http://osimple.co/,w2018,Software for inspectors to automate their paper workflow.OurMenu ,http://www.ourmenu.io/,w2018,Ovipost ,https://ovipost.com/,w2018,Ovipost automates insect productionPagedraw ,https://pagedraw.io/,w2018,"Pagedraw is a platform for productionizing designs into code. Thanks to Pagedraw, no one will ever have to learn HTML or CSS again, even for the most complex apps."Passerine Aircraft ,http://www.passerineaircraft.com/,w2018,Passerine Aircraft is builing the next generation of drones We are developing autonomous fixed wing aircraft capable of taking-off and landing like birds.Patchd Medical ,http://patchdmedical.com/,w2018,A wearable patch which uses machine learning to predict and prevent sepsis (the number 1 cause of hospital death) before people end up in hospital.Pathrise ,https://www.pathrise.com/,w2018,"Career accelerator for students, free until you're hired"Persephone Biome ,http://persephonebiome.com/,w2018,We are using the gut microbiome to cure cancer.Piccolo ,http://piccololabs.com/,w2018,Control your home with gestures.Playbook ,http://offlineisbetter.com/,w2018,We make it easy to hang out with college students around you.Players' Lounge ,https://playerslounge.co/,w2018,A marketplace to play video games against other people for money.PlayingViral ,http://www.playingviral.com/,w2018,PlayingViral machine learning powered surveys gamification for businesses to acquire leads and dataPlexus ,http://plexus.im/,w2018,"High-performance, affordable gloves for VR and AR"Precious ,https://itunes.apple.com/us/app/baby-art-by-precious/id1103530261,w2018,AI to curate your baby photosPromise ,http://www.joinpromise.com/,w2018,Proof ,https://useproof.com/,w2018,Proof Helps You Increase Website Conversions Through Personalized Social Proof.Proven ,https://www.tryproven.com/,w2018,We use data to tailor-make skin care products that ACTUALLY workPsylaris ,http://www.psylaris.com/,w2018,"We use VR to automate mental health techniques for B2C. Our mobile VR app reduces negative mood, anxiety, and stress, without the need for a therapist. Using insights from neuroscience and psychology, we improve your mental state and performance."Pulse ,https://www.pulse.qa/,w2018,We're crowdsourced Gartner so IT executives can learn directly from each other via simple Q&A instead of pay-to-play analyst reports. We're building the future $1T marketplace where enterprise buyers discover and buy technology.Quantierra ,http://quantierra.com/,w2018,Sourcing investment real estateQuantstamp ,https://quantstamp.com/,w2018,Security auditing for blockchain smart contractsQuit Genius ,https://www.quitgenius.com/,w2018,A mobile app that delivers personalised therapy to help people quit smoking.Qulture.Rocks ,http://qulture.rocks/,w2018,"Qulture.Rocks helps mid-sized companies implement 1:1s, goals, feedbacks and performance reviews in a heartbeat, with consumer-grade technology and hands on content that makes the process much easier. Our goal is to build Namely for Latin America."Repl.it ,https://repl.it/,w2018,"In 2 seconds, boot up an online programming environment for your favorite language."Reverie Labs ,http://www.reverielabs.com/,w2018,"Building a pharma company from scratch, using machine learning."Rhythmm ,https://getrhythmm.com/,w2018,Read interesting conversationsRopeo ,https://ropeo.com/,w2018,Subscription service that delivers a box of preselected clothes for users to try before buy and pay in cash - Stitch Fix for Latin AmericaRuna HR ,http://runahr.com/,w2018,"Automating payroll for Latin America. Our software platform includes: payroll, employee management, time tracking and reporting."SafetyWing ,http://www.safetywing.com/,w2018,A global safety net for online freelancers and entrepreneursSharpestMinds ,http://sharpestminds.com/,w2018,We connect top students and recent grads to businesses for internships in machine learning that lead to full-time jobs.Sheerly Genius ,http://sheerlygenius.com/,w2018,The world's first pair of indestructible pantyhose.Shogun ,https://getshogun.com/,w2018,eCommerce Storefront Builder.Shone ,http://www.shone.com/,w2018,Shone is bringing autonomous cargo ships to marketSixfold Bioscience ,https://www.sixfold.bio/,w2018,Nanoparticles to deliver cancer cures.Sketchbox ,https://www.sketchbox3d.com/,w2018,Photoshop for AR & VRSkip ,http://skipscooters.com/,w2018,Electric scooters for reliable last-mile transportation.Slite ,https://slite.com/,w2018,The note app for teamsSnackpass ,https://snackpass.co/,w2018,"Skip the line at restaurants, collect points and send gifts to friends 🎁"Sourcify ,http://www.trysourcify.com/,w2018,Sourcify is the fastest growing sourcing platform that helps hundreds of companies manufacture products around the world.Sqreen ,https://www.sqreen.io/,w2018,Sqreen revolutionizes the way engineering teams protect their apps & customers against attacks.Station ,https://getstation.com/,w2018,Station is building the browser for work. It is a native desktop application unifying within a single interface all of the web applications used by an employee at work.Storyline ,https://getstoryline.com/,w2018,Create Amazon Alexa apps without coding.Substack ,https://www.substack.com/,w2018,The platform for subscription publishingSudden Coffee ,https://www.suddencoffee.com/,w2018,Crystallized coffee that's better than fresh StarbucksSupermedium ,https://supermedium.com/,w2018,Browser for the VR Internet. Surf thousands of VR apps on the Web without having to install any of them.Swayable ,http://swayable.com/,w2018,"Swayable measures how media content changes minds, so advocacy organizations and brands can dramatically improve ROI."Tarjimly ,https://tarjim.ly/,w2018,"Tarjimly connects refugees and aid workers with realtime translators using Facebook Messenger. We allow bilinguals to volunteer their language skills to help refugees and immigrants struggling to communicate with doctors, lawyers, and NGOs."tEQuitable ,https://www.tequitable.com/,w2018,"tEQuitable helps companies get in front of and prevent harassment. We are an independent, confidential platform to address issues of bias, discrimination, and harassment in the workplace."The Lobby ,https://www.thelobby.io/,w2018,1-on-1 calls with company insiders to help you get hired.The One Health Company ,http://www.theonehealthcompany.com/,w2018,"Precision medicine for dogs that helps people too. We are focused on improving canine cancer care and also run clinical trials leveraging already sick dogs for predictive data, whilst providing cutting edge therapies for dogs in need."The Podcast App ,http://podcastapp.io/,w2018,The fastest growing podcast playerTingles ,https://www.gettingles.com/,w2018,"Tingles is a video platform for relaxation. It's the best place to find content that helps you relax and fall asleep. Our main focus is a video genre called ASMR, the biggest and fastest growing relaxation technique."Tipe ,https://tipe.io/,w2018,We make it so developers never have to manage text.Torch ,https://torch.io/,w2018,Tradewind BioScience ,https://www.tradewindbio.com/,w2018,Tradewind BioScience is building therapeutics to attack the most deadly human cancers. Our current lead is a humanized antibody that inhibits ovarian cancer growth and metastasis.Treasury Prime ,https://treasuryprime.com/,w2018,APIs to automate banking.Tributi ,http://tributi.com/,w2018,Automating tax filing preparation for individuals in Latam. Think TurboTax for Latam.Trusu ,http://trusu.com/,w2018,We allow anyone in Hong Kong/Asia to instantly order any product they love from the USAUniverse ,http://onuniverse.com/,w2018,Make an awesome website—from your phone.Vathys ,http://vathys.ai/,w2018,Deep learning processors 10X faster than the TPUVena Medical ,https://www.venamed.ca/,w2018,Making a tiny camera that goes inside veins and arteries to help physicians navigate around the bodyVeriff ,https://veriff.me/,w2018,Stripe for online identity verificationViaopt ,http://www.viaopt.com/,w2018,Viaopt helps companies save money and time on shipments by sharing trucksVisor ,https://www.visor.gg/,w2018,Visor helps every gamer improve by analyzing their gameplay in real-timeVoicery ,http://www.voicery.com/,w2018,Automated voice acting and emotive speech synthesis with deep neural networks.Volley ,http://volleythat.com/,w2018,Voice-controlled games on Alexa and Google HomeWing It ,http://m.me/gowingit?ref=bookface,w2018,Discover weekend getaways near you via Facebook Messenger. Live in the Bay Area.Worklytics ,https://www.worklytics.co/,w2018,"Worklytics is productivity analytics for teams, gathered from data in tools like G Suite, Slack and Office 365."YouTeam ,https://youteam.io/,w2018,A tech talent sharing platform. One million developers working at software firms are idle or between jobs at any present point in time. YouTeam enables businesses to hire those engineers as full-time contractors.ZBiotics ,http://www.zbiotics.com/,w2018,Zyper ,http://zyper.co/,w2018,Recreating social networks for brands.10 By 10 ,https://10by10.io/,s2017,10by10 is building a unique marketplace in the recruiting agency industry for recruiters to match engineers with jobs. Recruiting agencies have relationships with proven experienced engineers that you can't find in self-service job boards.70MillionJobs ,https://www.70millionjobs.com/,s2017,The Internet's first for-profit recruitment platform for people with criminal records. We match ignored talent (from our community of several million applicants) with jobs that companies can't fill.Advano ,http://www.advanotech.com/,s2017,"Advano's silicon nanoparticles dramatically increase the energy density lithium-ion batteries 30-40% without sacrificing battery life or increasing the battery cost. Better batteries for ioT, consumer electronics, and EVs."Airthium ,http://www.airthium.com/,s2017,We make large scale (1MW+) thermodynamic energy storage systems.AssemblyAI ,https://www.assemblyai.com/,s2017,"API for customizable, affordable speech recognition."Audm ,https://www.audm.com/,s2017,"Audm is a subscription service providing mini-audiobooks — word-for-word narrations — of longform articles from The New Yorker, The Atlantic, New York Magazine, POLITICO Magazine, WIRED, and many more publications."AutoHub ,https://www.autohub.io/,s2017,We help dealerships appraise vehicle trade-ins more efficiently accurately. AutoHub is the only appraisal tool that incorporates vehicle diagnostic data and cosmetic condition into a streamlined appraisal process.BillionToOne ,https://www.billiontoone.com/,s2017,Prenatal genetic testing for every expecting motherbxblue ,http://www.bxblue.com.br/,s2017,bxblue is a marketplace for people with guaranteed income in Brazil. This market has 42 million people that borrow over U$40 billion yearly (growing 20% YoY).Caelum Health ,https://caelumhealth.com/,s2017,"Caelum Health is replacing drugs with software. We use behavioral medicine, delivered digitally, to treat diseases where drugs don't work. We're starting with IBS, which affects 20% of the US and costs an additional $6,000 per individual each year."Cambridge Cancer Genomics ,http://ccg.ai/,s2017,CCG empowers clinicians to make personalised treatment strategies for cancer patients. We use blood monitoring to measure the effectiveness of cancer therapies and ML to tailor treatment decisions.CarDash ,http://www.cardash.com/,s2017,Managed marketplace for automotive services.Carrot Fertility ,https://get-carrot.com/,s2017,Customized fertility benefits for modern companies.Cashfree ,https://www.cashfree.com/,s2017,Next-Gen digital payments provider for India.CocuSocial ,http://www.cocusocial.com/,s2017,Marketplace for local activities.Contract Simply ,https://contractsimply.com/,s2017,Helping banks expedite construction loans. Large construction projects are financed by banks through a monthly invoice process called a draw request. Our software makes this process simple.Covetly ,https://www.covetly.com/,s2017,"Covetly is the #1 mobile destination for hobbyists to organize, appraise & trade their collections. This is THE RETAIL DREAM; a marketplace built on top of a daily utility to sort and value the same items sold!"CureSkin ,http://cureskin.com/,s2017,AI dermatologist for IndiaD-ID ,http://www.d-id.com/,s2017,"Protecting faces from being identified by facial recognition technologies. Helping governments, HLS and corporations to comply with regulations and secure their citizens, agents, employees and customers."dahmakan ,https://dahmakan.com/,s2017,dahmakan delivers ready-to-eat meals at below restaurant prices to the fast growing middle class in Asia.Darmiyan ,https://www.darmiyan.com/,s2017,Early detection of Alzheimer's diseaseDharma Labs ,https://dharma.io/,s2017,The Protocol for Borrowing and Lending on Blockchainsdisclosures.io ,https://disclosures.io/,s2017,"Disclosures.io helps real estate agents manage, share and review property disclosures."Dropleaf ,https://dropleaf.io/,s2017,Subscription service for all you can play indie PC games.Elucd ,http://www.elucd.com/,s2017,Polling through mobile ads to enable governments to make better decisions.Entocycle ,https://www.entocycle.com/,s2017,Automated factory to produce insect protein for farm animals.Enzyme ,https://www.enzyme.com/,s2017,Enzyme builds software that helps life science companies with FDA approval and compliance. Think TurboTax but for companies that need FDA approval.Escher Reality ,http://www.escherreality.com/,s2017,The backend for Augmented Reality.Fastpad ,https://fastpad.com/,s2017,Hiring Software for IndiaFat Lama ,https://fatlama.com/,s2017,"Fat Lama is the first fully insured peer-to-peer rental marketplace. The insurance allows us to focus on high end professional equipment such as DJ equipment, photography gear and more."Feather ,http://livefeather.com/,s2017,Feather is a furniture subscription service for people who aspire to live light.Flock ,http://www.flocksafety.com/,s2017,"Flock makes wireless security systems for neighborhoods. While only 13% of non-violent crime is solved today, with our wireless license plate reading cameras, our goal is to take that to 100%."Flowspace ,http://www.flow.space/,s2017,On-demand warehousing for business.Forever Labs ,https://foreverlabs.com/,s2017,"We bank your stem cells to help you live healthier, longer."FriendSpot ,http://facemailme.com/,s2017,FriendSpot is a group messaging app that helps you coordinate with your friends to meet up in the real world.Gameday ,http://playgameday.com/,s2017,Play fantasy sports with friends on Facebook MessengerGamelynx ,https://gamelynx.gg/,s2017,A spectator-friendly mobile eSport game for hardcore gamers.Goosebump ,http://m.me/higoosebump,s2017,Find the best electronic music events in a single message.